INPUT:meme	INPUT:kymLink	INPUT:description	OUTPUT:reason	OUTPUT:result	OUTPUT:comment	OUTPUT:meaning	OUTPUT:isRelatable	OUTPUT:text_review_mode	GOLDEN:reason	GOLDEN:result	GOLDEN:comment	GOLDEN:meaning	GOLDEN:isRelatable	GOLDEN:text_review_mode	HINT:text	HINT:default_language	ASSIGNMENT:link	ASSIGNMENT:task_id	ASSIGNMENT:assignment_id	ASSIGNMENT:worker_id	ASSIGNMENT:status	ASSIGNMENT:started
https://i.kym-cdn.com/photos/images/newsfeed/001/424/505/eb4.png	https://knowyourmeme.com/memes/surprised-pikachu	Surprised Pikachu refers to a screenshot from the Pokémon anime of the character Pikachu with its mouth agape, as though it were surprised at something. In the autumn of 2018, the image was used as a reaction image paired with captions where a set-up leads to a predictable outcome that nevertheless leaves one surprised.		"{""Relevant to the meaning"":[""In the autumn of 2018\, the image was""]}"		xaxaxaxaxaxaxaxaxaxaxaxaxa	yes	"{""class"":""text__unselected""\,""contentLength"":153},{""class"":""text__selected""\,""textInputClasses"":[""text__input""\,""text__input_green""]\,""tagSelectorClasses"":[""text__selected-inner""\,""text__selected-inner_green""]\,""contentLength"":37\,""value"":""Relevant to the meaning""},{""class"":""text__unselected""\,""contentLength"":131}"									https://platform.toloka.ai/task/42737525/00028c1f75--65aedd53b7b7c64213157216	00028c1f75--65aeb242acc1b67a2f3e6641	00028c1f75--65aedd53b7b7c64213157216	28f7e6734615f41bc0366dee5c563f09	APPROVED	2024-01-22T21:25:39.192
https://i.kym-cdn.com/photos/images/newsfeed/001/879/958/fb1.gif	https://knowyourmeme.com/memes/catjam-vibing-cat	CatJAM is a BetterTTV custom Twitch emote of a white cat rhythmically bobbing its head as if to the beat of a song. Originating from a viral video, the emote gained major success on Twitch after being enabled by multiple popular streamers, later gaining popularity as source material for memes. The GIF and the video are also known as Vibing Cat and Grooving Cat.		"{""Relevant to the meaning"":[""CatJAM is a BetterTTV custom Twitch emote of a white cat rhythmically bobbing its head as if to the beat of a song. Originating from a viral video\, the emote gained major success on Twitch after being enabled by multiple popular streamers\, later gaining popularity as source material for memes. The GIF and the video are also known as Vibing Cat and Grooving Cat.""]}"		vibing cat and grooving cat	yes	"{""class"":""text__selected""\,""textInputClasses"":[""text__input""\,""text__input_green""]\,""tagSelectorClasses"":[""text__selected-inner""\,""text__selected-inner_green""]\,""contentLength"":363\,""value"":""Relevant to the meaning""}"									https://platform.toloka.ai/task/42737525/00028c1f75--65aede07acc1b67a2f42ec69	00028c1f75--65aeb242acc1b67a2f3e6689	00028c1f75--65aede07acc1b67a2f42ec69	a1a3dd7b1b5349e197460bf7b4399e3c	APPROVED	2024-01-22T21:28:39.193
https://i.kym-cdn.com/photos/images/newsfeed/001/424/505/eb4.png	https://knowyourmeme.com/memes/surprised-pikachu	Surprised Pikachu refers to a screenshot from the Pokémon anime of the character Pikachu with its mouth agape, as though it were surprised at something. In the autumn of 2018, the image was used as a reaction image paired with captions where a set-up leads to a predictable outcome that nevertheless leaves one surprised.		"{""Relevant to the meaning"":[""Pikachu""\,""from""]}"		something you didn't expect	No	"{""class"":""text__unselected""\,""contentLength"":10},{""class"":""text__selected""\,""textInputClasses"":[""text__input""\,""text__input_green""]\,""tagSelectorClasses"":[""text__selected-inner""\,""text__selected-inner_green""]\,""contentLength"":8\,""value"":""Relevant to the meaning""},{""class"":""text__unselected""\,""contentLength"":23},{""class"":""text__selected""\,""textInputClasses"":[""text__input""\,""text__input_green""]\,""tagSelectorClasses"":[""text__selected-inner""\,""text__selected-inner_green""]\,""contentLength"":5\,""value"":""Relevant to the meaning""},{""class"":""text__unselected""\,""contentLength"":275}"									https://platform.toloka.ai/task/42737525/00028c1f75--65aede0ff0884d28d14871a7	00028c1f75--65aeb242acc1b67a2f3e6641	00028c1f75--65aede0ff0884d28d14871a7	be4d3c0277ae1187f09ca3f26b4edc95	APPROVED	2024-01-22T21:28:47.193
https://i.kym-cdn.com/photos/images/newsfeed/000/788/622/5e6.gif	https://knowyourmeme.com/memes/denied-encino-man	Denied Encino Man is a reaction GIF of American actor Michael DeLuise shaking his head in disapproval in a scene from the 1992 comedy film Encino Man. On image boards and discussion forums, the reaction GIF is often used to convey disapproval or rejection of an idea once thought to be promising.		"{""Relevant to the meaning"":[""Denied Encino Man is a reaction GIF of American actor Michael DeLuise shaking his head in disapproval in a scene from the 1992 comedy film Encino Man. On image boards and discussion forums\, the reaction GIF is often used to convey disapproval or rejection of an idea once thought to be promising.""]}"		i do not know this meme,sorry	no	"{""class"":""text__selected""\,""textInputClasses"":[""text__input""\,""text__input_green""]\,""tagSelectorClasses"":[""text__selected-inner""\,""text__selected-inner_green""]\,""contentLength"":296\,""value"":""Relevant to the meaning""}"									https://platform.toloka.ai/task/42737525/00028c1f75--65aede92b7b7c64213158a2b	00028c1f75--65aeb241acc1b67a2f3e662d	00028c1f75--65aede92b7b7c64213158a2b	a1a3dd7b1b5349e197460bf7b4399e3c	APPROVED	2024-01-22T21:30:58.162
https://i.kym-cdn.com/photos/images/newsfeed/000/439/824/c4a.png	https://knowyourmeme.com/memes/ive-made-a-huge-mistake	“I’ve Made a Huge Mistake” is an expression indicating that the speaker feels remorse for something that he or she has done. It is often associated with a reaction GIF featuring the character Gob from the television sitcom Arrested Development.		"{""Relevant to the meaning"":[""“I’ve Made a Huge Mistake”""]}"		disappointment from one's actions	Yes	"{""class"":""text__selected""\,""textInputClasses"":[""text__input""\,""text__input_green""]\,""tagSelectorClasses"":[""text__selected-inner""\,""text__selected-inner_green""]\,""contentLength"":27\,""value"":""Relevant to the meaning""},{""class"":""text__unselected""\,""contentLength"":217}"									https://platform.toloka.ai/task/42737525/00028c1f75--65aedec0753d7e7cfc02d72a	00028c1f75--65aeb242acc1b67a2f3e663b	00028c1f75--65aedec0753d7e7cfc02d72a	be4d3c0277ae1187f09ca3f26b4edc95	APPROVED	2024-01-22T21:31:44.560
https://i.kym-cdn.com/photos/images/newsfeed/000/396/532/019.gif	https://knowyourmeme.com/memes/are-you-a-wizard	Are You a Wizard? is an image macro series typically featuring wall-eyed subjects staring into the distance while wearing a confused-looking expression. It is sometimes used as a reaction image to an extraordinary or absurd remark on imageboards or web forums and can be used sarcastically to point out an obvious statement in a similar vein to Captain Obvious.		"{""Relevant to the meaning"":[""Are You a Wizard? is an image macro series typically featuring wall-eyed subjects staring into the distance while wearing a confused-looking expression. It is sometimes used as a reaction image to an extraordinary or absurd remark on imageboards or web forums and can be used sarcastically to point out an obvious statement in a similar vein to Captain Obvious.""]}"		i do not know this meme	no	"{""class"":""text__selected""\,""textInputClasses"":[""text__input""\,""text__input_green""]\,""tagSelectorClasses"":[""text__selected-inner""\,""text__selected-inner_green""]\,""contentLength"":361\,""value"":""Relevant to the meaning""}"									https://platform.toloka.ai/task/42737525/00028c1f75--65aedeff753d7e7cfc02dc12	00028c1f75--65aeb242acc1b67a2f3e6659	00028c1f75--65aedeff753d7e7cfc02dc12	a1a3dd7b1b5349e197460bf7b4399e3c	APPROVED	2024-01-22T21:32:47.052
https://i.kym-cdn.com/photos/images/newsfeed/000/962/640/658.png	https://knowyourmeme.com/memes/this-is-fine	This Is Fine. refers to a panel from the web comic  Gunshow where a dog is slowly engulfed in flames while proclaiming that everything is fine. It is used as a reaction image used by forum posters trying to say calm in stressful situations.		"{""Relevant to the meaning"":[""It is used as a reaction image used by forum posters trying to say calm in stressful situations.""]}"		something joyful and unexpected	No	"{""class"":""text__unselected""\,""contentLength"":144},{""class"":""text__selected""\,""textInputClasses"":[""text__input""\,""text__input_green""]\,""tagSelectorClasses"":[""text__selected-inner""\,""text__selected-inner_green""]\,""contentLength"":96\,""value"":""Relevant to the meaning""}"									https://platform.toloka.ai/task/42737525/00028c1f75--65aedf23acc1b67a2f42ffd3	00028c1f75--65aeb242acc1b67a2f3e6649	00028c1f75--65aedf23acc1b67a2f42ffd3	be4d3c0277ae1187f09ca3f26b4edc95	APPROVED	2024-01-22T21:33:23.266
https://i.kym-cdn.com/photos/images/newsfeed/001/407/224/0bc.png	https://knowyourmeme.com/memes/excuse-me-what-the-fuck	"Excuse Me What The Fuck is a series of reaction image macros of a distorted image of the character Vault Boy from the video game Fallout. The image features the caption ""excuse me what the fuck"" to express disbelief."		"{""Relevant to the meaning"":[""Excuse Me What The Fuck is a series of reaction image macros of a distorted image of the character Vault Boy from the video game Fallout. The image features the caption \\""excuse me what the fuck\\"" to express disbelief.""]}"		im not aware of the meme	no	"{""class"":""text__selected""\,""textInputClasses"":[""text__input""\,""text__input_green""]\,""tagSelectorClasses"":[""text__selected-inner""\,""text__selected-inner_green""]\,""contentLength"":216\,""value"":""Relevant to the meaning""}"									https://platform.toloka.ai/task/42737525/00028c1f75--65aedf57acc1b67a2f43031d	00028c1f75--65aeb242acc1b67a2f3e6691	00028c1f75--65aedf57acc1b67a2f43031d	a1a3dd7b1b5349e197460bf7b4399e3c	APPROVED	2024-01-22T21:34:15.541
https://i.kym-cdn.com/photos/images/newsfeed/001/168/745/e42.jpg	https://knowyourmeme.com/memes/darth-vaders-noooo	"Darth Vader's ""Noooo!"" refers to the widely parodied scene from the 2005 film Star Wars Episode III Revenge of the Sith, the third and final installment of the Star Wars prequel trilogy in which Darth Vader yells ""No!"" after finding out the fate of his pregnant wife, Padmé Amidala. This yell was also added in the 2011 Blu-Ray version of the movie Return of the Jedi. In memes, the clip has been used as an exploitable in YouTube Poops, as a reaction image and GIF, as well as various image macros over the years."		"{""Relevant to the meaning"":[""In memes\, the clip has been used as an exploitable in YouTube Poops\, as a reaction image and GIF\, as well as various image macros over the years.""]}"		great disappointment	Yes	"{""class"":""text__unselected""\,""contentLength"":369},{""class"":""text__selected""\,""textInputClasses"":[""text__input""\,""text__input_green""]\,""tagSelectorClasses"":[""text__selected-inner""\,""text__selected-inner_green""]\,""contentLength"":145\,""value"":""Relevant to the meaning""}"									https://platform.toloka.ai/task/42737525/00028c1f75--65aedfa7acc1b67a2f4308cb	00028c1f75--65aeb242acc1b67a2f3e669b	00028c1f75--65aedfa7acc1b67a2f4308cb	be4d3c0277ae1187f09ca3f26b4edc95	APPROVED	2024-01-22T21:35:35.596
https://i.kym-cdn.com/photos/images/newsfeed/001/070/332/b7a.jpg	https://knowyourmeme.com/memes/what-did-he-mean-by-this	What Did He Mean By This? is a question often posted on 4chan as a form of shitposting for lines that are either simplistic in nature, or confusing to the audience, it often seeks equally satirical responses. although its posted on most 4chan boards its seen used often on /tv/, /mu/ and [s4s].		"{""Relevant to the meaning"":[""What Did He Mean By This? is a question often posted on 4chan as a form of shitposting for lines that are either simplistic in nature\, or confusing to the audience\, it often seeks equally satirical responses. although its posted on most 4chan boards its seen used often on /tv/\, /mu/ and [s4s].""]}"		я не знаю этого мема	no	"{""class"":""text__selected""\,""textInputClasses"":[""text__input""\,""text__input_green""]\,""tagSelectorClasses"":[""text__selected-inner""\,""text__selected-inner_green""]\,""contentLength"":294\,""value"":""Relevant to the meaning""}"									https://platform.toloka.ai/task/42737525/00028c1f75--65aedfe6ee2612733d3d8184	00028c1f75--65aeb241acc1b67a2f3e6620	00028c1f75--65aedfe6ee2612733d3d8184	a1a3dd7b1b5349e197460bf7b4399e3c	APPROVED	2024-01-22T21:36:38.217
https://i.kym-cdn.com/photos/images/newsfeed/002/191/046/708	https://knowyourmeme.com/memes/traumatized-mr-incredible-people-who-dont-know-vs-people-who-know	"Traumatized Mr. Incredible refers to a series of comparison memes based on two images of Mr. Incredible, one an official art for The Incredibles 2 and the other a ""reverse toonified"" and black-and-white version of the character that gives him an expression of a man experiencing emotional pain, similar to Withered Wojak. Starting in September 2021, the format was used together with the caption People Who Don't Know / People Who Know in comparison memes."		"{""Relevant to the meaning"":[""other a \\""reverse toonified\\"" and black-and-white version of the character that gives him an expression of a man experiencing emotional pain\,""]}"		Very Funny meme for me	Yes	"{""class"":""text__unselected""\,""contentLength"":155},{""class"":""text__selected""\,""textInputClasses"":[""text__input""\,""text__input_green""]\,""tagSelectorClasses"":[""text__selected-inner""\,""text__selected-inner_green""]\,""contentLength"":140\,""value"":""Relevant to the meaning""},{""class"":""text__unselected""\,""contentLength"":161}"									https://platform.toloka.ai/task/42737525/00028c1f75--65aee887f0884d28d1493b65	00028c1f75--65aeb242acc1b67a2f3e66b1	00028c1f75--65aee887f0884d28d1493b65	49ac371bb2fc9525c3c1a535dcfea2c4	APPROVED	2024-01-22T22:13:27.414
https://i.kym-cdn.com/photos/images/newsfeed/001/240/075/90f.png	https://knowyourmeme.com/memes/my-job-here-is-done-but-you-didnt-do-anything	My Job Here Is Done is an 3-part exploitable picture from the Japanese animated series Sailor Moon, in which the character Tuxedo Mask dramatically leaves after attributing to himself some credits for a victory. This scene was exploited by many Internet users and edited to parody similar situations in different medias.		"{""Relevant to the meaning"":[""in which the character Tuxedo Mask dramatically leaves after attributing to himself some credits for a victory""]}"		Very Funny meme for me	No	"{""class"":""text__unselected""\,""contentLength"":100},{""class"":""text__selected""\,""textInputClasses"":[""text__input""\,""text__input_green""]\,""tagSelectorClasses"":[""text__selected-inner""\,""text__selected-inner_green""]\,""contentLength"":110\,""value"":""Relevant to the meaning""},{""class"":""text__unselected""\,""contentLength"":110}"									https://platform.toloka.ai/task/42737525/00028c1f75--65aee8d3753d7e7cfc03a479	00028c1f75--65aeb243acc1b67a2f3e6701	00028c1f75--65aee8d3753d7e7cfc03a479	49ac371bb2fc9525c3c1a535dcfea2c4	APPROVED	2024-01-22T22:14:43.669
https://i.kym-cdn.com/photos/images/newsfeed/000/416/789/c98.jpg	https://knowyourmeme.com/memes/fuck-me-right	Fuck Me, Right? is an image macro series featuring a screen capture of Jonah Hill sarcastically laughing in the 2007 comedy film Superbad. The top caption usually contains a confession about an unpopular opinion or noobish behavior, accompanied by the bottom caption “Fuck me, right?” The expression is meant to convey self-pity and resignation to the way the speaker is perceived by the majority.		"{""Relevant to the meaning"":[""the 2007 comedy film Superbad. The top caption usually contains a confession about an unpopular opinion or noobish behavior\, accompanied by the bottom caption “Fuck me\, right?”""]}"		Very funny meme for me	No	"{""class"":""text__unselected""\,""contentLength"":108},{""class"":""text__selected""\,""textInputClasses"":[""text__input""\,""text__input_green""]\,""tagSelectorClasses"":[""text__selected-inner""\,""text__selected-inner_green""]\,""contentLength"":176\,""value"":""Relevant to the meaning""},{""class"":""text__unselected""\,""contentLength"":113}"									https://platform.toloka.ai/task/42737525/00028c1f75--65aee918753d7e7cfc03a94a	00028c1f75--65aeb242acc1b67a2f3e663d	00028c1f75--65aee918753d7e7cfc03a94a	49ac371bb2fc9525c3c1a535dcfea2c4	APPROVED	2024-01-22T22:15:52.398
https://i.kym-cdn.com/photos/images/newsfeed/001/251/243/f32.jpg	https://knowyourmeme.com/memes/perfection	Perfection refers to an exploitable image macro in which the character Erik Magnus Lehnsherr (Michael Fassbender), aka Magneto, in X-Men: First Class asks to be shown “the real X.” He asks twice, and upon seeing what he is looking for, he says, “Perfection.” What he is looking for is generally the punchline of the joke.		"{""Relevant to the meaning"":[""X-Men: First Class asks to be shown “the real X""]}"		very funny meme for me	Yes	"{""class"":""text__unselected""\,""contentLength"":131},{""class"":""text__selected""\,""textInputClasses"":[""text__input""\,""text__input_green""]\,""tagSelectorClasses"":[""text__selected-inner""\,""text__selected-inner_green""]\,""contentLength"":47\,""value"":""Relevant to the meaning""},{""class"":""text__unselected""\,""contentLength"":143}"									https://platform.toloka.ai/task/42737525/00028c1f75--65aee962acc1b67a2f43ce80	00028c1f75--65aeb242acc1b67a2f3e66cf	00028c1f75--65aee962acc1b67a2f43ce80	49ac371bb2fc9525c3c1a535dcfea2c4	APPROVED	2024-01-22T22:17:06.366
https://i.kym-cdn.com/photos/images/newsfeed/000/396/532/019.gif	https://knowyourmeme.com/memes/are-you-a-wizard	Are You a Wizard? is an image macro series typically featuring wall-eyed subjects staring into the distance while wearing a confused-looking expression. It is sometimes used as a reaction image to an extraordinary or absurd remark on imageboards or web forums and can be used sarcastically to point out an obvious statement in a similar vein to Captain Obvious.		"{""Relevant to the meaning"":[""It is sometimes used as a reaction image to an extraordinary or absurd remark on imageboards or web forums and can be used sarcastically to point out an obvious statement in a similar vein to Captain Obvious.""]}"		Very funny meme for me	No	"{""class"":""text__unselected""\,""contentLength"":153},{""class"":""text__selected""\,""textInputClasses"":[""text__input""\,""text__input_green""]\,""tagSelectorClasses"":[""text__selected-inner""\,""text__selected-inner_green""]\,""contentLength"":208\,""value"":""Relevant to the meaning""}"									https://platform.toloka.ai/task/42737525/00028c1f75--65aee9e0ee2612733d3e4bdb	00028c1f75--65aeb242acc1b67a2f3e6659	00028c1f75--65aee9e0ee2612733d3e4bdb	49ac371bb2fc9525c3c1a535dcfea2c4	APPROVED	2024-01-22T22:19:12.249
https://i.kym-cdn.com/photos/images/newsfeed/001/407/224/0bc.png	https://knowyourmeme.com/memes/excuse-me-what-the-fuck	"Excuse Me What The Fuck is a series of reaction image macros of a distorted image of the character Vault Boy from the video game Fallout. The image features the caption ""excuse me what the fuck"" to express disbelief."		"{""Relevant to the meaning"":[""The image""]}"		Very funny meme for me	Yes	"{""class"":""text__unselected""\,""contentLength"":138},{""class"":""text__selected""\,""textInputClasses"":[""text__input""\,""text__input_green""]\,""tagSelectorClasses"":[""text__selected-inner""\,""text__selected-inner_green""]\,""contentLength"":10\,""value"":""Relevant to the meaning""},{""class"":""text__unselected""\,""contentLength"":68}"									https://platform.toloka.ai/task/42737525/00028c1f75--65aeea44f0884d28d1495f37	00028c1f75--65aeb242acc1b67a2f3e6691	00028c1f75--65aeea44f0884d28d1495f37	49ac371bb2fc9525c3c1a535dcfea2c4	APPROVED	2024-01-22T22:20:52.946
http://i.imgur.com/TO3Ed7u.png?1	https://knowyourmeme.com/memes/gavin	Gavin is the nephew of Vine star Nick Mastodon and an internet celebrity in his own right.		"{""Relevant to the meaning"":[""Gavin is the nephew of Vine star Nick Mastodon and an internet celebrity in his own right""]}"		vry funny meme for me	No	"{""class"":""text__selected""\,""textInputClasses"":[""text__input""\,""text__input_green""]\,""tagSelectorClasses"":[""text__selected-inner""\,""text__selected-inner_green""]\,""contentLength"":89\,""value"":""Relevant to the meaning""},{""class"":""text__unselected""\,""contentLength"":1}"									https://platform.toloka.ai/task/42737525/00028c1f75--65aeeaa1f0884d28d1496676	00028c1f75--65aeb242acc1b67a2f3e66cc	00028c1f75--65aeeaa1f0884d28d1496676	49ac371bb2fc9525c3c1a535dcfea2c4	APPROVED	2024-01-22T22:22:25.120
https://i.kym-cdn.com/photos/images/newsfeed/001/070/332/b7a.jpg	https://knowyourmeme.com/memes/what-did-he-mean-by-this	What Did He Mean By This? is a question often posted on 4chan as a form of shitposting for lines that are either simplistic in nature, or confusing to the audience, it often seeks equally satirical responses. although its posted on most 4chan boards its seen used often on /tv/, /mu/ and [s4s].		"{""Relevant to the meaning"":[""What Did He Mean By This""]}"		very funny meme for me	no	"{""class"":""text__selected""\,""textInputClasses"":[""text__input""\,""text__input_green""]\,""tagSelectorClasses"":[""text__selected-inner""\,""text__selected-inner_green""]\,""contentLength"":24\,""value"":""Relevant to the meaning""},{""class"":""text__unselected""\,""contentLength"":270}"									https://platform.toloka.ai/task/42737525/00028c1f75--65aeeb01f0884d28d1496efb	00028c1f75--65aeb241acc1b67a2f3e6620	00028c1f75--65aeeb01f0884d28d1496efb	49ac371bb2fc9525c3c1a535dcfea2c4	APPROVED	2024-01-22T22:24:01.655
https://i.kym-cdn.com/photos/images/newsfeed/001/338/774/dbc.jpg	https://knowyourmeme.com/memes/im-something-of-a-scientist-myself	“I’m Something of a Scientist Myself” is a memorable quote uttered by the character Norman Osborn (played by Willem Dafoe) in the 2002 superhero film Spider-Man, which inspired the creation of an image macro series using a screen-capture from the scene using the quote as a punchline.		"{""Relevant to the meaning"":[""“I’m Something of a Scientist Myself”""]}"		Very funny meme for me	yes	"{""class"":""text__selected""\,""textInputClasses"":[""text__input""\,""text__input_green""]\,""tagSelectorClasses"":[""text__selected-inner""\,""text__selected-inner_green""]\,""contentLength"":38\,""value"":""Relevant to the meaning""},{""class"":""text__unselected""\,""contentLength"":246}"									https://platform.toloka.ai/task/42737525/00028c1f75--65aeebc8753d7e7cfc03df9f	00028c1f75--65aeb242acc1b67a2f3e66c7	00028c1f75--65aeebc8753d7e7cfc03df9f	49ac371bb2fc9525c3c1a535dcfea2c4	APPROVED	2024-01-22T22:27:20.191
https://i.kym-cdn.com/photos/images/newsfeed/002/239/757/17c.jpg	https://knowyourmeme.com/memes/the-rocks-eyebrow-raise	"The Rock's Eyebrow Raise refers to a series of reaction videos of actor and former professional wrestler Dwayne ""The Rock"" Johnson raising his eyebrow accompanied by the Vine Thud. The memes first gained popularity in March 2021, achieving a major surge in September 2021 as users paired the reactions, used to convey suspicion, with various ""suspect"" videos, and created 21st Century Humor memes."		"{""Relevant to the meaning"":[""\\""suspect\\"" videos""]}"		Very funny meme fo me	No	"{""class"":""text__unselected""\,""contentLength"":342},{""class"":""text__selected""\,""textInputClasses"":[""text__input""\,""text__input_green""]\,""tagSelectorClasses"":[""text__selected-inner""\,""text__selected-inner_green""]\,""contentLength"":16\,""value"":""Relevant to the meaning""},{""class"":""text__unselected""\,""contentLength"":39}"									https://platform.toloka.ai/task/42737525/00028c1f75--65aeec0cf0884d28d149852e	00028c1f75--65aeb242acc1b67a2f3e66bc	00028c1f75--65aeec0cf0884d28d149852e	49ac371bb2fc9525c3c1a535dcfea2c4	APPROVED	2024-01-22T22:28:28.146
https://i.kym-cdn.com/photos/images/newsfeed/000/210/119/9b3.png	https://knowyourmeme.com/memes/you-dont-say--3	"""You Don't Say?"" is a rage comic character based on a contour drawing of American actor Nicolas Cage which is used as a sarcastic response to an obvious observation or statement, in a similar vein to the ""O RLY"" reaction images."		"{""Relevant to the meaning"":[""\\""You Don't Say""]}"		Very funny meme for me	no	"{""class"":""text__selected""\,""textInputClasses"":[""text__input""\,""text__input_green""]\,""tagSelectorClasses"":[""text__selected-inner""\,""text__selected-inner_green""]\,""contentLength"":14\,""value"":""Relevant to the meaning""},{""class"":""text__unselected""\,""contentLength"":214}"									https://platform.toloka.ai/task/42737525/00028c1f75--65aeed24753d7e7cfc03fb32	00028c1f75--65aeb242acc1b67a2f3e6653	00028c1f75--65aeed24753d7e7cfc03fb32	49ac371bb2fc9525c3c1a535dcfea2c4	APPROVED	2024-01-22T22:33:08.962
