INPUT:meme	INPUT:kymLink	INPUT:description	OUTPUT:reason	OUTPUT:result	OUTPUT:comment	OUTPUT:meaning	OUTPUT:isRelatable	OUTPUT:text_review_mode	GOLDEN:reason	GOLDEN:result	GOLDEN:comment	GOLDEN:meaning	GOLDEN:isRelatable	GOLDEN:text_review_mode	HINT:text	HINT:default_language	ASSIGNMENT:link	ASSIGNMENT:task_id	ASSIGNMENT:assignment_id	ASSIGNMENT:worker_id	ASSIGNMENT:status	ASSIGNMENT:started
https://i.kym-cdn.com/photos/images/newsfeed/001/251/243/f32.jpg	https://knowyourmeme.com/memes/perfection	Perfection refers to an exploitable image macro in which the character Erik Magnus Lehnsherr (Michael Fassbender), aka Magneto, in X-Men: First Class asks to be shown “the real X.” He asks twice, and upon seeing what he is looking for, he says, “Perfection.” What he is looking for is generally the punchline of the joke.		"{""Relevant to the meaning"":[""Erik Magnus Lehnsherr (Michael Fassbender""]}"		ou highlighted 'Relevant to the meaning' 	no	"{""class"":""text__unselected""\,""contentLength"":71},{""class"":""text__selected""\,""textInputClasses"":[""text__input""\,""text__input_green""]\,""tagSelectorClasses"":[""text__selected-inner""\,""text__selected-inner_green""]\,""contentLength"":41\,""value"":""Relevant to the meaning""},{""class"":""text__unselected""\,""contentLength"":209}"									https://platform.toloka.ai/task/42737525/00028c1f75--65aebb6e753d7e7cfcffa986	00028c1f75--65aeb242acc1b67a2f3e66cf	00028c1f75--65aebb6e753d7e7cfcffa986	10085ad2d0c56f7b4a9348b0ccbafed7	APPROVED	2024-01-22T19:01:02.422
https://i.kym-cdn.com/photos/images/newsfeed/001/424/505/eb4.png	https://knowyourmeme.com/memes/surprised-pikachu	Surprised Pikachu refers to a screenshot from the Pokémon anime of the character Pikachu with its mouth agape, as though it were surprised at something. In the autumn of 2018, the image was used as a reaction image paired with captions where a set-up leads to a predictable outcome that nevertheless leaves one surprised.		"{""Relevant to the meaning"":[""Surprised Pikachu""]}"		 if you highlighted 'Relevant to the meaning' 	yes	"{""class"":""text__selected""\,""textInputClasses"":[""text__input""\,""text__input_green""]\,""tagSelectorClasses"":[""text__selected-inner""\,""text__selected-inner_green""]\,""contentLength"":18\,""value"":""Relevant to the meaning""},{""class"":""text__unselected""\,""contentLength"":303}"									https://platform.toloka.ai/task/42737525/00028c1f75--65aebb97acc1b67a2f3fd43e	00028c1f75--65aeb242acc1b67a2f3e6641	00028c1f75--65aebb97acc1b67a2f3fd43e	10085ad2d0c56f7b4a9348b0ccbafed7	APPROVED	2024-01-22T19:01:43.526
https://i.kym-cdn.com/photos/images/newsfeed/002/191/046/708	https://knowyourmeme.com/memes/traumatized-mr-incredible-people-who-dont-know-vs-people-who-know	"Traumatized Mr. Incredible refers to a series of comparison memes based on two images of Mr. Incredible, one an official art for The Incredibles 2 and the other a ""reverse toonified"" and black-and-white version of the character that gives him an expression of a man experiencing emotional pain, similar to Withered Wojak. Starting in September 2021, the format was used together with the caption People Who Don't Know / People Who Know in comparison memes."		"{""Relevant to the meaning"":[""Traumatized Mr. Incredible""]}"		meaning if you highlighted 'Relevant to the meaning	yes	"{""class"":""text__selected""\,""textInputClasses"":[""text__input""\,""text__input_green""]\,""tagSelectorClasses"":[""text__selected-inner""\,""text__selected-inner_green""]\,""contentLength"":27\,""value"":""Relevant to the meaning""},{""class"":""text__unselected""\,""contentLength"":429}"									https://platform.toloka.ai/task/42737525/00028c1f75--65aebbb8acc1b67a2f3fd6b3	00028c1f75--65aeb242acc1b67a2f3e66b1	00028c1f75--65aebbb8acc1b67a2f3fd6b3	10085ad2d0c56f7b4a9348b0ccbafed7	APPROVED	2024-01-22T19:02:16.291
https://i.kym-cdn.com/photos/images/newsfeed/001/831/746/e50.png	https://knowyourmeme.com/memes/pointing-rick-dalton	Pointing Rick Dalton, also known as Pointing Leonardo DiCaprio, is an image macro meme featuring a screenshot from the 2019 film Once Upon a Time in Hollywood. Online, the image of actor Leonardo DiCaprio sitting in a chair with a beer and cigarette in his hand pointing at a television screen has been used to express feelings of excited recognition.		"{""Relevant to the meaning"":[""Pointing Leonardo DiCaprio""]}"		f you highlighted 'Relevant to the meaning	yes	"{""class"":""text__unselected""\,""contentLength"":36},{""class"":""text__selected""\,""textInputClasses"":[""text__input""\,""text__input_green""]\,""tagSelectorClasses"":[""text__selected-inner""\,""text__selected-inner_green""]\,""contentLength"":26\,""value"":""Relevant to the meaning""},{""class"":""text__unselected""\,""contentLength"":289}"									https://platform.toloka.ai/task/42737525/00028c1f75--65aebd0b753d7e7cfcffcd12	00028c1f75--65aeb242acc1b67a2f3e66dd	00028c1f75--65aebd0b753d7e7cfcffcd12	10085ad2d0c56f7b4a9348b0ccbafed7	APPROVED	2024-01-22T19:07:55.636
http://i.imgur.com/TO3Ed7u.png?1	https://knowyourmeme.com/memes/gavin	Gavin is the nephew of Vine star Nick Mastodon and an internet celebrity in his own right.		"{""Relevant to the meaning"":[""Gavin""]}"		 the meme's meaning if you highlighted 'Relevant to the meaning'	no	"{""class"":""text__selected""\,""textInputClasses"":[""text__input""\,""text__input_green""]\,""tagSelectorClasses"":[""text__selected-inner""\,""text__selected-inner_green""]\,""contentLength"":6\,""value"":""Relevant to the meaning""},{""class"":""text__unselected""\,""contentLength"":84}"									https://platform.toloka.ai/task/42737525/00028c1f75--65aebd2cf0884d28d1459cda	00028c1f75--65aeb242acc1b67a2f3e66cc	00028c1f75--65aebd2cf0884d28d1459cda	10085ad2d0c56f7b4a9348b0ccbafed7	APPROVED	2024-01-22T19:08:28.440
https://i.kym-cdn.com/photos/images/newsfeed/001/338/774/dbc.jpg	https://knowyourmeme.com/memes/im-something-of-a-scientist-myself	“I’m Something of a Scientist Myself” is a memorable quote uttered by the character Norman Osborn (played by Willem Dafoe) in the 2002 superhero film Spider-Man, which inspired the creation of an image macro series using a screen-capture from the scene using the quote as a punchline.		"{""Relevant to the meaning"":[""“I’m Something of a Scientist Myself”""]}"		e's meaning if you highlighted 'Relevant to the meaning'	yes	"{""class"":""text__selected""\,""textInputClasses"":[""text__input""\,""text__input_green""]\,""tagSelectorClasses"":[""text__selected-inner""\,""text__selected-inner_green""]\,""contentLength"":38\,""value"":""Relevant to the meaning""},{""class"":""text__unselected""\,""contentLength"":246}"									https://platform.toloka.ai/task/42737525/00028c1f75--65aebd4c753d7e7cfcffd297	00028c1f75--65aeb242acc1b67a2f3e66c7	00028c1f75--65aebd4c753d7e7cfcffd297	10085ad2d0c56f7b4a9348b0ccbafed7	APPROVED	2024-01-22T19:09:00.963
https://i.kym-cdn.com/photos/images/newsfeed/001/448/479/df5.png	https://knowyourmeme.com/memes/you-guys-are-getting-paid	"""You Guys Are Getting Paid?"" is a line spoken by Will Poulter's character Kenny Rossmore in the 2013 American comedy film We're the Millers. Starting around early 2019, the scene became an image macro and object-labeling meme format used to display surprise at another's previously unknown monetary income."		"{""Relevant to the meaning"":[""Poulter's character Kenny Rossmore in the 2013 American comedy film We're the Millers. Starting around early 2019\, the scene became an image macro and object-labeling meme""]}"		o clear meaning in descriptio	no	"{""class"":""text__unselected""\,""contentLength"":54},{""class"":""text__selected""\,""textInputClasses"":[""text__input""\,""text__input_green""]\,""tagSelectorClasses"":[""text__selected-inner""\,""text__selected-inner_green""]\,""contentLength"":172\,""value"":""Relevant to the meaning""},{""class"":""text__unselected""\,""contentLength"":80}"									https://platform.toloka.ai/task/42737525/00028c1f75--65aebd6d753d7e7cfcffd5bd	00028c1f75--65aeb242acc1b67a2f3e66a3	00028c1f75--65aebd6d753d7e7cfcffd5bd	10085ad2d0c56f7b4a9348b0ccbafed7	APPROVED	2024-01-22T19:09:33.110
https://i.kym-cdn.com/photos/images/newsfeed/000/210/119/9b3.png	https://knowyourmeme.com/memes/you-dont-say--3	"""You Don't Say?"" is a rage comic character based on a contour drawing of American actor Nicolas Cage which is used as a sarcastic response to an obvious observation or statement, in a similar vein to the ""O RLY"" reaction images."		"{""Relevant to the meaning"":[""\\""You Don't Say""]}"		ning if you highlighted 'Relevant to the meanin	yes	"{""class"":""text__selected""\,""textInputClasses"":[""text__input""\,""text__input_green""]\,""tagSelectorClasses"":[""text__selected-inner""\,""text__selected-inner_green""]\,""contentLength"":14\,""value"":""Relevant to the meaning""},{""class"":""text__unselected""\,""contentLength"":214}"									https://platform.toloka.ai/task/42737525/00028c1f75--65aebda7753d7e7cfcffda3d	00028c1f75--65aeb242acc1b67a2f3e6653	00028c1f75--65aebda7753d7e7cfcffda3d	10085ad2d0c56f7b4a9348b0ccbafed7	APPROVED	2024-01-22T19:10:31.529
https://i.kym-cdn.com/photos/images/masonry/000/352/151/8de	https://knowyourmeme.com/memes/am-i-the-only-one-around-here	Am I The Only One Around Here (also known as “Angry Walter”) is an advice animal image macro series featuring a screenshot of the character Walter Sobchak (played by John Goodman) drawing a gun in the 1998 comedy film The Big Lebowski. The captions often convey the feeling that the poster is alone in holding an unpopular opinion.		"{""Relevant to the meaning"":[""Am I The Only One Around Here""]}"		ighlighted 'Relevant to the meanin	yes	"{""class"":""text__selected""\,""textInputClasses"":[""text__input""\,""text__input_green""]\,""tagSelectorClasses"":[""text__selected-inner""\,""text__selected-inner_green""]\,""contentLength"":30\,""value"":""Relevant to the meaning""},{""class"":""text__unselected""\,""contentLength"":301}"									https://platform.toloka.ai/task/42737525/00028c1f75--65aebdc8ee2612733d3ab2c4	00028c1f75--65aeb242acc1b67a2f3e669d	00028c1f75--65aebdc8ee2612733d3ab2c4	10085ad2d0c56f7b4a9348b0ccbafed7	APPROVED	2024-01-22T19:11:04.205
https://i.kym-cdn.com/photos/images/newsfeed/001/880/649/cd8.png	https://knowyourmeme.com/memes/leonardo-dicaprio-laughing	Leonardo DiCaprio Laughing is an image macro of Calvin Candie played by Leonardo DiCaprio in the 2012 film Django Unchained which features the character smiling while holding a drink. The image gained Photoshop edits starting in November 2017 and became a popular reaction image in August 2020 on Reddit.		"{""Relevant to the meaning"":[""Leonardo DiCaprio Laughing""]}"		 highlighted 'Relevant to the meaning	yes	"{""class"":""text__selected""\,""textInputClasses"":[""text__input""\,""text__input_green""]\,""tagSelectorClasses"":[""text__selected-inner""\,""text__selected-inner_green""]\,""contentLength"":27\,""value"":""Relevant to the meaning""},{""class"":""text__unselected""\,""contentLength"":277}"									https://platform.toloka.ai/task/42737525/00028c1f75--65aebdeaf0884d28d145ace7	00028c1f75--65aeb242acc1b67a2f3e66be	00028c1f75--65aebdeaf0884d28d145ace7	10085ad2d0c56f7b4a9348b0ccbafed7	APPROVED	2024-01-22T19:11:38.132
https://i.kym-cdn.com/photos/images/newsfeed/002/005/159/bf8.jpg	https://knowyourmeme.com/memes/patrick-bateman-with-an-axe	Patrick Bateman with An Axe refers to a reaction image and image macro of the character Patrick Bateman (played by Christian Bale) from the 2000 film American Psycho swinging an axe with a slight grin. In memes, the still of the scene is typically used when another person says or does something that the other person hates or doesn't agree with. It's also used in Rage Comics as a reaction to proceeding captions, as well as being used as an exploitable where it is photoshopped to include elements from other pop culture references.		"{""Relevant to the meaning"":[""Patrick Bateman with An Axe""]}"		highlighted 'Relevant to the meaning'	yes	"{""class"":""text__selected""\,""textInputClasses"":[""text__input""\,""text__input_green""]\,""tagSelectorClasses"":[""text__selected-inner""\,""text__selected-inner_green""]\,""contentLength"":28\,""value"":""Relevant to the meaning""},{""class"":""text__unselected""\,""contentLength"":506}"									https://platform.toloka.ai/task/42737525/00028c1f75--65aebe1d753d7e7cfcffe509	00028c1f75--65aeb242acc1b67a2f3e66ca	00028c1f75--65aebe1d753d7e7cfcffe509	10085ad2d0c56f7b4a9348b0ccbafed7	APPROVED	2024-01-22T19:12:29.812
https://i.kym-cdn.com/photos/images/newsfeed/000/001/384/Atrapitis.gif	https://knowyourmeme.com/memes/its-a-trap	“It’s A Trap!” is a catchphrase that is often used as a reaction image to photos of transsexuals and crossdressers (often referred to as “traps”), or people who appear sexually ambiguous. It usually means that the person in question has male reproductive organs, regardless of their appearance. Though less frequently, the phrase can be also used as a warning of any potential danger. In addition, the quote as it appears in the film has been widely regarded by the fans of Star Wars as one of the most famous and beloved lines from the original trilogy.		"{""Relevant to the meaning"":[""“It’s A Trap!”""]}"		Write your understanding of the meme's meaning if you highlighted 'Relevant to the meaning' 	yes	"{""class"":""text__selected""\,""textInputClasses"":[""text__input""\,""text__input_green""]\,""tagSelectorClasses"":[""text__selected-inner""\,""text__selected-inner_green""]\,""contentLength"":14\,""value"":""Relevant to the meaning""},{""class"":""text__unselected""\,""contentLength"":540}"									https://platform.toloka.ai/task/42737525/00028c1f75--65aebe42f0884d28d145b4a5	00028c1f75--65aeb242acc1b67a2f3e6657	00028c1f75--65aebe42f0884d28d145b4a5	10085ad2d0c56f7b4a9348b0ccbafed7	APPROVED	2024-01-22T19:13:06.459
https://i.kym-cdn.com/photos/images/newsfeed/001/005/298/55c.png	https://knowyourmeme.com/memes/how-do-you-do-fellow-kids	“How Do You Do, Fellow Kids?” is a reaction image commonly used to respond to users pretending to be part of a community that they are clearly unfamiliar with. The image features the actor Steve Buscemi dressed youthfully and holding a skateboard, and is usually subtitled with the tag line. The image is often photoshopped to adapt to a particular subculture, and the phrase is often used in conversation without the image.		"{""Relevant to the meaning"":[""“How Do You Do\, Fellow Kids""]}"		Write your understanding of the meme's meaning if you highlighted 'Relevant to the meaning' 	yes	"{""class"":""text__selected""\,""textInputClasses"":[""text__input""\,""text__input_green""]\,""tagSelectorClasses"":[""text__selected-inner""\,""text__selected-inner_green""]\,""contentLength"":27\,""value"":""Relevant to the meaning""},{""class"":""text__unselected""\,""contentLength"":397}"									https://platform.toloka.ai/task/42737525/00028c1f75--65aebe87f0884d28d145bad2	00028c1f75--65aeb242acc1b67a2f3e6673	00028c1f75--65aebe87f0884d28d145bad2	10085ad2d0c56f7b4a9348b0ccbafed7	APPROVED	2024-01-22T19:14:15.374
https://i.kym-cdn.com/photos/images/newsfeed/000/102/970/x-x-everywhere.png?1318992465	https://knowyourmeme.com/memes/x-x-everywhere	X, X Everywhere is a phrasal template typically used for a wide range of cultural references, from quotable lines heard in popular films and TV shows to more obscure things found in viral videos and games. Many instances of “X Everywhere” may be seen as an indicator for emerging trends, while some should be read as a grievance or complaint against them, depending on the context.		"{""Relevant to the meaning"":[""X\, X Everywhere""]}"		Write your understanding of the meme's meaning if you highlighted 'Relevant to the meaning' 	yes	"{""class"":""text__selected""\,""textInputClasses"":[""text__input""\,""text__input_green""]\,""tagSelectorClasses"":[""text__selected-inner""\,""text__selected-inner_green""]\,""contentLength"":16\,""value"":""Relevant to the meaning""},{""class"":""text__unselected""\,""contentLength"":365}"									https://platform.toloka.ai/task/42737525/00028c1f75--65aebeaef0884d28d145be5c	00028c1f75--65aeb242acc1b67a2f3e6669	00028c1f75--65aebeaef0884d28d145be5c	10085ad2d0c56f7b4a9348b0ccbafed7	APPROVED	2024-01-22T19:14:54.185
https://i.kym-cdn.com/photos/images/newsfeed/001/467/098/949.jpg	https://knowyourmeme.com/memes/im-about-to-end-this-mans-whole-career	"I'm About to End This Man's Whole Career refers to a memorable quote from 2011 viral YouTube video ""The Rap Battle [Parody]"". Starting February 2019, the screen capture of the scene paired with the quote was circulated as an image macro in reference to situations in which one's reputation or social status could be harmed."		"{""Relevant to the meaning"":[""I'm About to End This Man's Whole Career""]}"		Write your understanding of the meme's meaning if you highlighted 'Relevant to the meaning' 	yes	"{""class"":""text__selected""\,""textInputClasses"":[""text__input""\,""text__input_green""]\,""tagSelectorClasses"":[""text__selected-inner""\,""text__selected-inner_green""]\,""contentLength"":41\,""value"":""Relevant to the meaning""},{""class"":""text__unselected""\,""contentLength"":282}"									https://platform.toloka.ai/task/42737525/00028c1f75--65aebed5f0884d28d145c131	00028c1f75--65aeb242acc1b67a2f3e66e4	00028c1f75--65aebed5f0884d28d145c131	10085ad2d0c56f7b4a9348b0ccbafed7	APPROVED	2024-01-22T19:15:33.450
https://i.kym-cdn.com/photos/images/newsfeed/000/881/938/453.png	https://knowyourmeme.com/memes/trigger	“Trigger” is a term referring to any stimulus that evokes the memory of a traumatic event or episode. While the word is most commonly used in the context of Post Traumatic Stress Disorder (PTSD), it has been since adopted by those in the social justice blogosphere to refer to any topical issue that is deemed contentious or debatable, and to a lesser extent, the term has been also re-appropriated as an ironic term used by their detractors to criticize certain issues that may be seen as too trivial or irrelevant to discuss in length.		"{""Relevant to the meaning"":[""“Trigger”""]}"		Write your understanding of the meme's meaning if you highlighted 'Relevant to the meaning' 	no	"{""class"":""text__selected""\,""textInputClasses"":[""text__input""\,""text__input_green""]\,""tagSelectorClasses"":[""text__selected-inner""\,""text__selected-inner_green""]\,""contentLength"":10\,""value"":""Relevant to the meaning""},{""class"":""text__unselected""\,""contentLength"":527}"									https://platform.toloka.ai/task/42737525/00028c1f75--65aebef6f0884d28d145c3c2	00028c1f75--65aeb242acc1b67a2f3e666f	00028c1f75--65aebef6f0884d28d145c3c2	10085ad2d0c56f7b4a9348b0ccbafed7	APPROVED	2024-01-22T19:16:06.368
https://i.kym-cdn.com/photos/images/newsfeed/001/505/717/49b.jpg	https://knowyourmeme.com/memes/woman-yelling-at-a-cat	Woman Yelling at a Cat refers to a meme format featuring a screen cap of The Real Housewives of Beverly Hills cast members Taylor Armstrong and Kyle Richards followed by a picture of a confused-looking cat sitting behind a dinner plate. The format gained significant popularity across the web in mid-June 2019 and the cat was later identified as Smudge the Cat.		"{""Relevant to the meaning"":[""Woman Yelling at a Cat""]}"		Write your understanding of the meme's meaning if you highlighted 'Relevant to the meaning' 	yes	"{""class"":""text__selected""\,""textInputClasses"":[""text__input""\,""text__input_green""]\,""tagSelectorClasses"":[""text__selected-inner""\,""text__selected-inner_green""]\,""contentLength"":23\,""value"":""Relevant to the meaning""},{""class"":""text__unselected""\,""contentLength"":338}"									https://platform.toloka.ai/task/42737525/00028c1f75--65aebf17f0884d28d145c6cd	00028c1f75--65aeb242acc1b67a2f3e6645	00028c1f75--65aebf17f0884d28d145c6cd	10085ad2d0c56f7b4a9348b0ccbafed7	APPROVED	2024-01-22T19:16:39.313
https://i.kym-cdn.com/photos/images/newsfeed/001/445/963/523.jpg	https://knowyourmeme.com/memes/but-its-honest-work	"But It's Honest Work is a reaction image macro series featuring a photograph of a farmer named Dave Brandt saying ""It ain't much, but it's honest work."" After appearing in 2014, the meme format spread online, particularly on Reddit during the late 2010s."		"{""Relevant to the meaning"":[""reaction image macro series featuring a photograph of a farmer named Dave Brandt saying \\""It ain't much\, but it's honest work""]}"		Write your understanding of the meme's meaning if you highlighted 'Relevant to the meaning' 	no	"{""class"":""text__unselected""\,""contentLength"":26},{""class"":""text__selected""\,""textInputClasses"":[""text__input""\,""text__input_green""]\,""tagSelectorClasses"":[""text__selected-inner""\,""text__selected-inner_green""]\,""contentLength"":124\,""value"":""Relevant to the meaning""},{""class"":""text__unselected""\,""contentLength"":104}"									https://platform.toloka.ai/task/42737525/00028c1f75--65aebf38753d7e7cfc000090	00028c1f75--65aeb242acc1b67a2f3e6685	00028c1f75--65aebf38753d7e7cfc000090	10085ad2d0c56f7b4a9348b0ccbafed7	APPROVED	2024-01-22T19:17:12.560
https://i.kym-cdn.com/photos/images/newsfeed/000/421/322/41a.jpg	https://knowyourmeme.com/memes/in-soviet-russia	“In Soviet Russia” or “the Russian Reversal” is a type of joke created by stand-up comedian Yakov Smirnoff. The joke was extremely popular in the late 80’s, fell out of vogue in the 90’s, and has been given new life among various online communities.		"{""Relevant to the meaning"":[""“In Soviet Russia”""]}"		Write your understanding of the meme's meaning if you highlighted 'Relevant to the meaning' 	yes	"{""class"":""text__selected""\,""textInputClasses"":[""text__input""\,""text__input_green""]\,""tagSelectorClasses"":[""text__selected-inner""\,""text__selected-inner_green""]\,""contentLength"":19\,""value"":""Relevant to the meaning""},{""class"":""text__unselected""\,""contentLength"":230}"									https://platform.toloka.ai/task/42737525/00028c1f75--65aebf59acc1b67a2f402838	00028c1f75--65aeb241acc1b67a2f3e6614	00028c1f75--65aebf59acc1b67a2f402838	10085ad2d0c56f7b4a9348b0ccbafed7	APPROVED	2024-01-22T19:17:45.423
https://i.kym-cdn.com/photos/images/newsfeed/000/912/336/58c.png	https://knowyourmeme.com/memes/is-this-a-pigeon	“Is this a pigeon?” is a memorable quote said by the protagonist character from the 1990s Japanese anime TV series The Brave Fighter of Sun Fighbird in a scene wherein the humanoid character erroneously identifies a butterfly as a pigeon. On Tumblr, the quote, along with a reaction image of the scene featuring the English-translated subtitle, is widely used to express utter confusion.		"{""Relevant to the meaning"":[""“Is this a pigeon""]}"		Write your understanding of the meme's meaning if you highlighted 'Relevant to the meaning' 	yes	"{""class"":""text__selected""\,""textInputClasses"":[""text__input""\,""text__input_green""]\,""tagSelectorClasses"":[""text__selected-inner""\,""text__selected-inner_green""]\,""contentLength"":17\,""value"":""Relevant to the meaning""},{""class"":""text__unselected""\,""contentLength"":370}"									https://platform.toloka.ai/task/42737525/00028c1f75--65aebf82acc1b67a2f402c8e	00028c1f75--65aeb242acc1b67a2f3e665d	00028c1f75--65aebf82acc1b67a2f402c8e	10085ad2d0c56f7b4a9348b0ccbafed7	APPROVED	2024-01-22T19:18:26.689
https://i.kym-cdn.com/photos/images/newsfeed/000/684/058/5eb.jpg	https://knowyourmeme.com/memes/tips-fedora	“Tips Fedora” is an online expression used in mocking response to a statement of opinion thought to be held by a young adult male who probably wears fedora as a fashion accessory. The phrase refers to the gesture of tipping one’s hat as an expression of recognition or acknowledgement between two persons.		"{""Relevant to the meaning"":[""is an online expression used in mocking response to a statement of opinion thought to be held""]}"		Write your understanding of the meme's meaning if you highlighted 'Relevant to the meaning' 	yes	"{""class"":""text__unselected""\,""contentLength"":14},{""class"":""text__selected""\,""textInputClasses"":[""text__input""\,""text__input_green""]\,""tagSelectorClasses"":[""text__selected-inner""\,""text__selected-inner_green""]\,""contentLength"":94\,""value"":""Relevant to the meaning""},{""class"":""text__unselected""\,""contentLength"":197}"									https://platform.toloka.ai/task/42737525/00028c1f75--65aebfa9753d7e7cfc000af5	00028c1f75--65aeb242acc1b67a2f3e6661	00028c1f75--65aebfa9753d7e7cfc000af5	10085ad2d0c56f7b4a9348b0ccbafed7	APPROVED	2024-01-22T19:19:05.146
https://i.kym-cdn.com/photos/images/newsfeed/000/200/420/BRTky.jpg?1321408042	https://knowyourmeme.com/memes/neil-degrasse-tyson-reaction	"Neil deGrasse Tyson Reaction is a rage comic character and reaction face of astrophysicist Neil deGrasse Tyson making a defensive gesture. The character image is sometimes associated with the catchphrase ""Watch out guys, we're dealing with a badass over here"" that is used to mock arrogant and boastful statements made by Internet users."		"{""Relevant to the meaning"":[""Neil deGrasse Tyson Reaction""]}"		Write your understanding of the meme's meaning if you highlighted 'Relevant to the meaning' 	yes	"{""class"":""text__selected""\,""textInputClasses"":[""text__input""\,""text__input_green""]\,""tagSelectorClasses"":[""text__selected-inner""\,""text__selected-inner_green""]\,""contentLength"":29\,""value"":""Relevant to the meaning""},{""class"":""text__unselected""\,""contentLength"":308}"									https://platform.toloka.ai/task/42737525/00028c1f75--65aebfceb7b7c6421312f979	00028c1f75--65aeb242acc1b67a2f3e6655	00028c1f75--65aebfceb7b7c6421312f979	10085ad2d0c56f7b4a9348b0ccbafed7	APPROVED	2024-01-22T19:19:42.388
