INPUT:meme	INPUT:kymLink	INPUT:description	OUTPUT:reason	OUTPUT:result	OUTPUT:comment	OUTPUT:meaning	OUTPUT:isRelatable	OUTPUT:text_review_mode	GOLDEN:reason	GOLDEN:result	GOLDEN:comment	GOLDEN:meaning	GOLDEN:isRelatable	GOLDEN:text_review_mode	HINT:text	HINT:default_language	ASSIGNMENT:link	ASSIGNMENT:task_id	ASSIGNMENT:assignment_id	ASSIGNMENT:worker_id	ASSIGNMENT:status	ASSIGNMENT:started
https://i.kym-cdn.com/photos/images/newsfeed/001/561/333/ad2.jpg	https://knowyourmeme.com/memes/mike-wazowski-sulley-face-swap	Mike Wazowski-Sulley Face Swap refers to an image of Monsters Inc. character Mike Wazowski with the face of character Sulley photoshopped over his own. Online, the image gained popularity as a reaction and has also been used in ironic memes.		"{""Relevant to the meaning"":[""Mike Wazowski-Sulley Face Swap""]}"		Write your understanding of the meme's meaning if you highlighted 'Relevant to the meaning' 	yes	"{""class"":""text__selected""\,""textInputClasses"":[""text__input""\,""text__input_green""]\,""tagSelectorClasses"":[""text__selected-inner""\,""text__selected-inner_green""]\,""contentLength"":31\,""value"":""Relevant to the meaning""},{""class"":""text__unselected""\,""contentLength"":210}"									https://platform.toloka.ai/task/42737525/00028c1f75--65aebff1acc1b67a2f40359e	00028c1f75--65aeb242acc1b67a2f3e6683	00028c1f75--65aebff1acc1b67a2f40359e	10085ad2d0c56f7b4a9348b0ccbafed7	APPROVED	2024-01-22T19:20:17.693
https://i.kym-cdn.com/photos/images/newsfeed/002/239/757/17c.jpg	https://knowyourmeme.com/memes/the-rocks-eyebrow-raise	"The Rock's Eyebrow Raise refers to a series of reaction videos of actor and former professional wrestler Dwayne ""The Rock"" Johnson raising his eyebrow accompanied by the Vine Thud. The memes first gained popularity in March 2021, achieving a major surge in September 2021 as users paired the reactions, used to convey suspicion, with various ""suspect"" videos, and created 21st Century Humor memes."		"{""Relevant to the meaning"":[""The Rock's Eyebrow Raise""]}"		Write your understanding of the meme's meaning if you highlighted 'Relevant to the meaning' 	yes	"{""class"":""text__selected""\,""textInputClasses"":[""text__input""\,""text__input_green""]\,""tagSelectorClasses"":[""text__selected-inner""\,""text__selected-inner_green""]\,""contentLength"":25\,""value"":""Relevant to the meaning""},{""class"":""text__unselected""\,""contentLength"":372}"									https://platform.toloka.ai/task/42737525/00028c1f75--65aec015ee2612733d3ae4ab	00028c1f75--65aeb242acc1b67a2f3e66bc	00028c1f75--65aec015ee2612733d3ae4ab	10085ad2d0c56f7b4a9348b0ccbafed7	APPROVED	2024-01-22T19:20:53.928
https://i.kym-cdn.com/photos/images/newsfeed/000/191/081/DSC_0165_c_mini.jpg	https://knowyourmeme.com/memes/do-you-think-this-is-a-game	“You Think This is a Motherfucking Game?” is a rhetorical question commonly associated with image macros of Starecat and other cute animals. Juxtaposing cuteness and intimidating language, the image macros are typically used as reaction images in response to flippant statements or behaviors.		"{""Relevant to the meaning"":[""rhetorical question commonly associated with image macros of Starecat and other cute animals""]}"		Write your understanding of the meme's meaning if you highlighted 'Relevant to the meaning' 	yes	"{""class"":""text__unselected""\,""contentLength"":47},{""class"":""text__selected""\,""textInputClasses"":[""text__input""\,""text__input_green""]\,""tagSelectorClasses"":[""text__selected-inner""\,""text__selected-inner_green""]\,""contentLength"":92\,""value"":""Relevant to the meaning""},{""class"":""text__unselected""\,""contentLength"":153}"									https://platform.toloka.ai/task/42737525/00028c1f75--65aec03facc1b67a2f403c9b	00028c1f75--65aeb242acc1b67a2f3e6631	00028c1f75--65aec03facc1b67a2f403c9b	10085ad2d0c56f7b4a9348b0ccbafed7	APPROVED	2024-01-22T19:21:35.061
https://i.kym-cdn.com/photos/images/newsfeed/001/474/924/d0b.jpg	https://knowyourmeme.com/memes/tuxedo-winnie-the-pooh	"Tuxedo Winnie the Pooh, also known as ""A Fellow Man of Culture"" refers to a photoshopped image of character Winnie the Pooh sitting in an armchair. Initially circulated as a reaction image on 4chan, in March 2019 the image gained mainstream popularity on Reddit."		"{""Relevant to the meaning"":[""Tuxedo Winnie the Pooh""]}"		Write your understanding of the meme's meaning if you highlighted 'Relevant to the meaning' 	yes	"{""class"":""text__selected""\,""textInputClasses"":[""text__input""\,""text__input_green""]\,""tagSelectorClasses"":[""text__selected-inner""\,""text__selected-inner_green""]\,""contentLength"":22\,""value"":""Relevant to the meaning""},{""class"":""text__unselected""\,""contentLength"":240}"									https://platform.toloka.ai/task/42737525/00028c1f75--65aec071f0884d28d145e701	00028c1f75--65aeb242acc1b67a2f3e66b3	00028c1f75--65aec071f0884d28d145e701	10085ad2d0c56f7b4a9348b0ccbafed7	APPROVED	2024-01-22T19:22:25.841
https://i.kym-cdn.com/photos/images/newsfeed/000/967/608/38b.gif	https://knowyourmeme.com/memes/bless-this-post	Bless This Post is an internet expression that is used to passionately agree with another user. It is most commonly used as a gif, the source of which ranges from popular television series to actual televangelist speakers. The subject is generally raising their hands or spreading their arms, as if literally blessing the post or quoted text before them.		"{""Relevant to the meaning"":[""internet expression that is used to passionately agree with another user""]}"		Write your understanding of the meme's meaning if you highlighted 'Relevant to the meaning' 	yes	"{""class"":""text__unselected""\,""contentLength"":22},{""class"":""text__selected""\,""textInputClasses"":[""text__input""\,""text__input_green""]\,""tagSelectorClasses"":[""text__selected-inner""\,""text__selected-inner_green""]\,""contentLength"":72\,""value"":""Relevant to the meaning""},{""class"":""text__unselected""\,""contentLength"":260}"									https://platform.toloka.ai/task/42737525/00028c1f75--65aec093b7b7c64213130bfb	00028c1f75--65aeb241acc1b67a2f3e6622	00028c1f75--65aec093b7b7c64213130bfb	10085ad2d0c56f7b4a9348b0ccbafed7	APPROVED	2024-01-22T19:22:59.164
https://i.kym-cdn.com/photos/images/newsfeed/000/591/926/700.jpg	https://knowyourmeme.com/memes/feels-good	Feels Good, not to be confused with Feels Good, Man, is an exploitable image of a man looking very satisfied while touching his face with both hands. On 4chan, the image is used to express satisfaction in response to another post.		"{""Relevant to the meaning"":[""Feels Good""\,""not to be confused with Feels Good""]}"		man is feels good hi is not confused	yes	"{""class"":""text__selected""\,""textInputClasses"":[""text__input""\,""text__input_green""]\,""tagSelectorClasses"":[""text__selected-inner""\,""text__selected-inner_green""]\,""contentLength"":10\,""value"":""Relevant to the meaning""},{""class"":""text__unselected""\,""contentLength"":2},{""class"":""text__selected""\,""textInputClasses"":[""text__input""\,""text__input_green""]\,""tagSelectorClasses"":[""text__selected-inner""\,""text__selected-inner_green""]\,""contentLength"":34\,""value"":""Relevant to the meaning""},{""class"":""text__unselected""\,""contentLength"":184}"									https://platform.toloka.ai/task/42737525/00028c1f75--65aec0aa753d7e7cfc0023cd	00028c1f75--65aeb242acc1b67a2f3e6675	00028c1f75--65aec0aa753d7e7cfc0023cd	e9882966cb0434ecd339e08151085bd0	APPROVED	2024-01-22T19:23:22.923
https://i.kym-cdn.com/photos/images/newsfeed/001/564/945/0cd.png	https://knowyourmeme.com/memes/kekw	KEKW is a FrankerFaceZ extension Twitch emote featuring an image of Spanish comedian and actor Juan Joya Borja, better known as the Spanish Laughing Guy. In late summer 2019, the custom emote gained popularity on the streaming platform as a way to convey laughter.		"{""Relevant to the meaning"":[""emote featuring an image of Spanish comedian and actor Juan Joya Borja""]}"		aning if you highlighted 'Relevant to the mea	yes	"{""class"":""text__unselected""\,""contentLength"":40},{""class"":""text__selected""\,""textInputClasses"":[""text__input""\,""text__input_green""]\,""tagSelectorClasses"":[""text__selected-inner""\,""text__selected-inner_green""]\,""contentLength"":70\,""value"":""Relevant to the meaning""},{""class"":""text__unselected""\,""contentLength"":154}"									https://platform.toloka.ai/task/42737525/00028c1f75--65aec0b4b7b7c64213130fc3	00028c1f75--65aeb242acc1b67a2f3e664b	00028c1f75--65aec0b4b7b7c64213130fc3	10085ad2d0c56f7b4a9348b0ccbafed7	APPROVED	2024-01-22T19:23:32.511
https://i.kym-cdn.com/photos/images/newsfeed/001/842/713/b73.jpg	https://knowyourmeme.com/memes/go-to-horny-jail	Go to Horny Jail is a slang phrase associated with an image macro of a Doge hitting another with a stick. The image and phrase has been used as a reaction to people being horny on main on social media.		"{""Relevant to the meaning"":[""phrase has been used as a reaction to people being horny on main on social media""]}"		vant to the meang if you highlighted 'Releva	yes	"{""class"":""text__unselected""\,""contentLength"":120},{""class"":""text__selected""\,""textInputClasses"":[""text__input""\,""text__input_green""]\,""tagSelectorClasses"":[""text__selected-inner""\,""text__selected-inner_green""]\,""contentLength"":80\,""value"":""Relevant to the meaning""},{""class"":""text__unselected""\,""contentLength"":1}"									https://platform.toloka.ai/task/42737525/00028c1f75--65aec0d5f0884d28d145f0b6	00028c1f75--65aeb242acc1b67a2f3e666d	00028c1f75--65aec0d5f0884d28d145f0b6	10085ad2d0c56f7b4a9348b0ccbafed7	APPROVED	2024-01-22T19:24:05.599
https://i.kym-cdn.com/photos/images/list/000/219/900/de4.png	https://knowyourmeme.com/memes/sad-pikachu	This meme came from season 1, episode 42 of Pokemon. So far there are no variations. The meme features Ash's Pikachu after having it's ketchup bottle cut by		"{""Relevant to the meaning"":[""meme came from season""]}"		ou highlighted 'Relevant to the meani	no	"{""class"":""text__unselected""\,""contentLength"":5},{""class"":""text__selected""\,""textInputClasses"":[""text__input""\,""text__input_green""]\,""tagSelectorClasses"":[""text__selected-inner""\,""text__selected-inner_green""]\,""contentLength"":22\,""value"":""Relevant to the meaning""},{""class"":""text__unselected""\,""contentLength"":129}"									https://platform.toloka.ai/task/42737525/00028c1f75--65aec0fdacc1b67a2f404dbd	00028c1f75--65aeb242acc1b67a2f3e663f	00028c1f75--65aec0fdacc1b67a2f404dbd	10085ad2d0c56f7b4a9348b0ccbafed7	APPROVED	2024-01-22T19:24:45.697
https://i.kym-cdn.com/photos/images/newsfeed/000/183/767/allthethings20110725-22047-1c7n473.png?1318992465	https://knowyourmeme.com/memes/all-the-things	“X all the Y”, sometimes known as “X all the things”, is a snowclone and exploitable cartoon used to make a hyperbolic statement about performing an action. The person in the original comic panel is often manipulated to appear as a different character. (See also: fsjal)		"{""Relevant to the meaning"":[""hyperbolic statement about performing an action""]}"		Write your understanding of the meme's meaning if you highlighted 'Relevant to the meaning' 	yes	"{""class"":""text__unselected""\,""contentLength"":108},{""class"":""text__selected""\,""textInputClasses"":[""text__input""\,""text__input_green""]\,""tagSelectorClasses"":[""text__selected-inner""\,""text__selected-inner_green""]\,""contentLength"":47\,""value"":""Relevant to the meaning""},{""class"":""text__unselected""\,""contentLength"":115}"									https://platform.toloka.ai/task/42737525/00028c1f75--65aec11f753d7e7cfc002eb4	00028c1f75--65aeb242acc1b67a2f3e6647	00028c1f75--65aec11f753d7e7cfc002eb4	10085ad2d0c56f7b4a9348b0ccbafed7	APPROVED	2024-01-22T19:25:19.063
https://i.kym-cdn.com/photos/images/newsfeed/001/176/251/4d7.png	https://knowyourmeme.com/memes/hackerman	Hackerman refers to an image of actor Rami Malek dressed as his character Elliot Alderson from the USA Netowork television show Mr. Robot paired with the text “HACKERMAN” taken from a clip of the 2015 film Kung Fury.		"{""Relevant to the meaning"":[""Hackerman""]}"		Write your understanding of the meme's meaning if you highlighted 'Relevant to the meaning' 	yes	"{""class"":""text__selected""\,""textInputClasses"":[""text__input""\,""text__input_green""]\,""tagSelectorClasses"":[""text__selected-inner""\,""text__selected-inner_green""]\,""contentLength"":10\,""value"":""Relevant to the meaning""},{""class"":""text__unselected""\,""contentLength"":206}"									https://platform.toloka.ai/task/42737525/00028c1f75--65aec13fb7b7c64213131a11	00028c1f75--65aeb242acc1b67a2f3e6679	00028c1f75--65aec13fb7b7c64213131a11	10085ad2d0c56f7b4a9348b0ccbafed7	APPROVED	2024-01-22T19:25:51.351
https://i.kym-cdn.com/photos/images/newsfeed/001/340/526/3bb.jpg	https://knowyourmeme.com/memes/monkey-puppet	Monkey Puppet refers to a reaction image and GIF of a puppet appearing surprised. It’s used to express shock, particularly in situations where one party owns another in a verbal exchange.		"{""Relevant to the meaning"":[""Monkey Puppet refers to a reaction image and GIF of a puppet appearing surprised.""]}"		monkey puppet is very surprised about situation that hi looks	yes	"{""class"":""text__selected""\,""textInputClasses"":[""text__input""\,""text__input_green""]\,""tagSelectorClasses"":[""text__selected-inner""\,""text__selected-inner_green""]\,""contentLength"":82\,""value"":""Relevant to the meaning""},{""class"":""text__unselected""\,""contentLength"":105}"									https://platform.toloka.ai/task/42737525/00028c1f75--65aec148acc1b67a2f405380	00028c1f75--65aeb242acc1b67a2f3e66a1	00028c1f75--65aec148acc1b67a2f405380	e9882966cb0434ecd339e08151085bd0	APPROVED	2024-01-22T19:26:00.196
https://i.kym-cdn.com/photos/images/newsfeed/001/658/686/a79.png	https://knowyourmeme.com/memes/you-son-of-a-bitch-im-in	"""You Son of a Bitch, I'm In"" is a catchphrase said by multiple characters in Rick and Morty episode ""One Crew over the Crewcoo's Morty"" upon being convinced to participate in a heist. Online, several image macros, particularly one depicting Rick Sanchez putting a lollipop in his mouth, gained popularity, often used in reference to convincing arguments."		"{""Relevant to the meaning"":[""\\""You Son of a Bitch\, I'm In\\""""]}"		Write your understanding of the meme's meaning if you highlighted 'Relevant to the meaning' 	yes	"{""class"":""text__selected""\,""textInputClasses"":[""text__input""\,""text__input_green""]\,""tagSelectorClasses"":[""text__selected-inner""\,""text__selected-inner_green""]\,""contentLength"":29\,""value"":""Relevant to the meaning""},{""class"":""text__unselected""\,""contentLength"":325}"									https://platform.toloka.ai/task/42737525/00028c1f75--65aec15facc1b67a2f405592	00028c1f75--65aeb242acc1b67a2f3e66d3	00028c1f75--65aec15facc1b67a2f405592	10085ad2d0c56f7b4a9348b0ccbafed7	APPROVED	2024-01-22T19:26:23.146
https://i.kym-cdn.com/photos/images/newsfeed/001/790/571/8fa.jpg	https://knowyourmeme.com/memes/disappointed-black-guy	Disappointed Black Guy is a four-panel reaction image macro that expresses the expectation-reality meme. The format follows the following order: a picture of something (the meme author desires or anticiapts) juxtaposes a photograph of a happy excited man. The third panel usually reveals the full picture of the first panel, which is very different and unappealing, followed by a picture of the same person, but now with an expression of disappointment or shock.		"{""Relevant to the meaning"":[""reaction image macro that expresses the expectation-reality meme""]}"		Write your understanding of the meme's meaning if you highlighted 'Relevant to the meaning' 	yes	"{""class"":""text__unselected""\,""contentLength"":39},{""class"":""text__selected""\,""textInputClasses"":[""text__input""\,""text__input_green""]\,""tagSelectorClasses"":[""text__selected-inner""\,""text__selected-inner_green""]\,""contentLength"":64\,""value"":""Relevant to the meaning""},{""class"":""text__unselected""\,""contentLength"":359}"									https://platform.toloka.ai/task/42737525/00028c1f75--65aec180ee2612733d3b0371	00028c1f75--65aeb241acc1b67a2f3e661c	00028c1f75--65aec180ee2612733d3b0371	10085ad2d0c56f7b4a9348b0ccbafed7	APPROVED	2024-01-22T19:26:56.154
https://i.kym-cdn.com/photos/images/newsfeed/001/350/061/422.jpg	https://knowyourmeme.com/memes/grus-plan	Gru’s Plan is an exploitable four-pane comic series featuring the Despicable Me protagonist Gru using a presentation board. Edits of the comic typically feature an unexpected third presentation page, followed by a panel of Gru looking back at the board in confusion.		"{""Relevant to the meaning"":[""Despicable Me protagonist Gru using a presentation board""]}"		Write your understanding of the meme's meaning if you highlighted 'Relevant to the meaning' 	no	"{""class"":""text__unselected""\,""contentLength"":66},{""class"":""text__selected""\,""textInputClasses"":[""text__input""\,""text__input_green""]\,""tagSelectorClasses"":[""text__selected-inner""\,""text__selected-inner_green""]\,""contentLength"":56\,""value"":""Relevant to the meaning""},{""class"":""text__unselected""\,""contentLength"":144}"									https://platform.toloka.ai/task/42737525/00028c1f75--65aec1a0b7b7c6421313242a	00028c1f75--65aeb242acc1b67a2f3e66df	00028c1f75--65aec1a0b7b7c6421313242a	10085ad2d0c56f7b4a9348b0ccbafed7	APPROVED	2024-01-22T19:27:28.536
https://i.kym-cdn.com/photos/images/newsfeed/001/240/075/90f.png	https://knowyourmeme.com/memes/my-job-here-is-done-but-you-didnt-do-anything	My Job Here Is Done is an 3-part exploitable picture from the Japanese animated series Sailor Moon, in which the character Tuxedo Mask dramatically leaves after attributing to himself some credits for a victory. This scene was exploited by many Internet users and edited to parody similar situations in different medias.		"{""Relevant to the meaning"":[""My Job Here Is Done is an 3-part exploitable picture from the Japanese animated series Sailor Moon\, in which the character Tuxedo Mask dramatically leaves after attributing to himself some credits for a victory.""]}"		he old? that his job is done and dramaticaly leaves the scene	yes	"{""class"":""text__selected""\,""textInputClasses"":[""text__input""\,""text__input_green""]\,""tagSelectorClasses"":[""text__selected-inner""\,""text__selected-inner_green""]\,""contentLength"":212\,""value"":""Relevant to the meaning""},{""class"":""text__unselected""\,""contentLength"":108}"									https://platform.toloka.ai/task/42737525/00028c1f75--65aecafd753d7e7cfc01124c	00028c1f75--65aeb243acc1b67a2f3e6701	00028c1f75--65aecafd753d7e7cfc01124c	e9882966cb0434ecd339e08151085bd0	APPROVED	2024-01-22T20:07:25.533
https://i.kym-cdn.com/photos/images/newsfeed/001/475/420/c62.gif	https://knowyourmeme.com/memes/hello-there	Hello There is a memorable quote uttered by the character Obi-Wan Kenobi, portrayed by actor Ewan McGregor, in the 2005 science fiction action film Star Wars: Episode III – Revenge of the Sith. Online, the scene has been used to create various remix videos and image macros, as well as seeing use as a catchphrase.		"{""Relevant to the meaning"":[""Online\, the scene has been used to create various remix videos and image macros\, as well as seeing use as a catchphrase.""]}"		its was used to create remix videos  and image macros	yes	"{""class"":""text__unselected""\,""contentLength"":194},{""class"":""text__selected""\,""textInputClasses"":[""text__input""\,""text__input_green""]\,""tagSelectorClasses"":[""text__selected-inner""\,""text__selected-inner_green""]\,""contentLength"":120\,""value"":""Relevant to the meaning""}"									https://platform.toloka.ai/task/42737525/00028c1f75--65aecb6eacc1b67a2f4126db	00028c1f75--65aeb242acc1b67a2f3e6643	00028c1f75--65aecb6eacc1b67a2f4126db	e9882966cb0434ecd339e08151085bd0	APPROVED	2024-01-22T20:09:18.352
https://i.kym-cdn.com/photos/images/newsfeed/001/717/942/188.png	https://knowyourmeme.com/memes/sad-linus	"Sad Linus is a still image of tech YouTuber Linus Sebastian taken from his January 2020 video ""I've been thinking of retiring."" The image, which features Linus staring solemnly at the camera with his headset on, has been used as a reaction image and in ironic memes on Reddit and iFunny."		"{""Relevant to the meaning"":[""Sad Linus is a still image of tech YouTuber Linus Sebastian taken from his January 2020 video \\""I've been thinking of retiring.\\""""]}"		its about diference betwin boys and gerls 	no	"{""class"":""text__selected""\,""textInputClasses"":[""text__input""\,""text__input_green""]\,""tagSelectorClasses"":[""text__selected-inner""\,""text__selected-inner_green""]\,""contentLength"":128\,""value"":""Relevant to the meaning""},{""class"":""text__unselected""\,""contentLength"":159}"									https://platform.toloka.ai/task/42737525/00028c1f75--65aecbe4acc1b67a2f4133f5	00028c1f75--65aeb242acc1b67a2f3e66d9	00028c1f75--65aecbe4acc1b67a2f4133f5	e9882966cb0434ecd339e08151085bd0	APPROVED	2024-01-22T20:11:16.880
https://i.kym-cdn.com/photos/images/newsfeed/000/239/099/cc9.jpg	https://knowyourmeme.com/memes/first-day-on-the-internet-kid	First Day on the Internet Kid is a new and inexperienced Internet user who is unfamiliar with certain aspects of the web and is often described as a younger version of Lonely Computer Guy / Net Noob.		"{""Relevant to the meaning"":[""First Day on the Internet Kid is a new and inexperienced Internet user who is unfamiliar with certain aspects of the web and is often described as a younger version of Lonely Computer Guy""]}"		its about net noob? this is his first day in the internett	no	"{""class"":""text__selected""\,""textInputClasses"":[""text__input""\,""text__input_green""]\,""tagSelectorClasses"":[""text__selected-inner""\,""text__selected-inner_green""]\,""contentLength"":188\,""value"":""Relevant to the meaning""},{""class"":""text__unselected""\,""contentLength"":11}"									https://platform.toloka.ai/task/42737525/00028c1f75--65aecc48ee2612733d3bdac5	00028c1f75--65aeb242acc1b67a2f3e668f	00028c1f75--65aecc48ee2612733d3bdac5	e9882966cb0434ecd339e08151085bd0	APPROVED	2024-01-22T20:12:56.804
https://i.kym-cdn.com/photos/images/newsfeed/001/562/298/45b.jpg	https://knowyourmeme.com/memes/yes-chad	"Yes Chad, also known as Nordic Gamer, refers to a drawn image of a blond man with blue eyes often wearing a beard, usually captioned ""Yes"" and to the original Wojak Comics format based on the character."		"{""Relevant to the meaning"":[""Yes Chad\, also known as Nordic Gamer\, refers to a drawn image of a blond man with blue eyes often wearing a beard""]}"		hi is a virgine because his do not wearing a beard	yes	"{""class"":""text__selected""\,""textInputClasses"":[""text__input""\,""text__input_green""]\,""tagSelectorClasses"":[""text__selected-inner""\,""text__selected-inner_green""]\,""contentLength"":113\,""value"":""Relevant to the meaning""},{""class"":""text__unselected""\,""contentLength"":89}"									https://platform.toloka.ai/task/42737525/00028c1f75--65aeccb8f0884d28d146eb4c	00028c1f75--65aeb242acc1b67a2f3e6667	00028c1f75--65aeccb8f0884d28d146eb4c	e9882966cb0434ecd339e08151085bd0	APPROVED	2024-01-22T20:14:48.855
https://i.kym-cdn.com/photos/images/newsfeed/000/793/340/387.png	https://knowyourmeme.com/memes/jared-leto-hugging-things	Jared Leto Hugging Things is a photoshop meme in which people take a photo the actor posted to his Instagram account featuring him hugging a tree and photoshop it so it appears Leto is hugging other things.		"{""Relevant to the meaning"":[""Jared Leto Hugging Things is a photoshop meme in which people take a photo the actor posted to his Instagram account""]}"		there are many photoshops memes when Leto is hugging different things	yes	"{""class"":""text__selected""\,""textInputClasses"":[""text__input""\,""text__input_green""]\,""tagSelectorClasses"":[""text__selected-inner""\,""text__selected-inner_green""]\,""contentLength"":117\,""value"":""Relevant to the meaning""},{""class"":""text__unselected""\,""contentLength"":89}"									https://platform.toloka.ai/task/42737525/00028c1f75--65aecd0dee2612733d3bed81	00028c1f75--65aeb241acc1b67a2f3e6629	00028c1f75--65aecd0dee2612733d3bed81	e9882966cb0434ecd339e08151085bd0	APPROVED	2024-01-22T20:16:13.414
https://i.kym-cdn.com/photos/images/newsfeed/000/591/926/700.jpg	https://knowyourmeme.com/memes/feels-good	Feels Good, not to be confused with Feels Good, Man, is an exploitable image of a man looking very satisfied while touching his face with both hands. On 4chan, the image is used to express satisfaction in response to another post.		"{""Relevant to the meaning"":[""satisfaction""]}"		man d ds s dsd sddsdsd	no	"{""class"":""text__unselected""\,""contentLength"":189},{""class"":""text__selected""\,""textInputClasses"":[""text__input""\,""text__input_green""]\,""tagSelectorClasses"":[""text__selected-inner""\,""text__selected-inner_green""]\,""contentLength"":13\,""value"":""Relevant to the meaning""},{""class"":""text__unselected""\,""contentLength"":28}"									https://platform.toloka.ai/task/42737525/00028c1f75--65aecd72ee2612733d3bf8b1	00028c1f75--65aeb242acc1b67a2f3e6675	00028c1f75--65aecd72ee2612733d3bf8b1	455e3a2111dc76524e3e6243bdf37427	APPROVED	2024-01-22T20:17:54.144
