INPUT:meme	INPUT:kymLink	INPUT:description	OUTPUT:reason	OUTPUT:result	OUTPUT:comment	OUTPUT:meaning	OUTPUT:isRelatable	OUTPUT:text_review_mode	GOLDEN:reason	GOLDEN:result	GOLDEN:comment	GOLDEN:meaning	GOLDEN:isRelatable	GOLDEN:text_review_mode	HINT:text	HINT:default_language	ASSIGNMENT:link	ASSIGNMENT:task_id	ASSIGNMENT:assignment_id	ASSIGNMENT:worker_id	ASSIGNMENT:status	ASSIGNMENT:started
https://i.kym-cdn.com/photos/images/newsfeed/000/862/065/0e9.jpg	https://knowyourmeme.com/memes/smug-frog	Smug Frog, also known as Smug Pepe, is a reaction image of a smug-looking frog based on an original cartoon illustration of Pepe, better known as Feels Good Man and Sad Frog, drawn by webcomic artist Matt Furie.		"{""Relevant to the meaning"":[""Smug""]}"		fghfg fghfgh fghfg fhgf  fghfh 	no	"{""class"":""text__unselected""\,""contentLength"":25},{""class"":""text__selected""\,""textInputClasses"":[""text__input""\,""text__input_green""]\,""tagSelectorClasses"":[""text__selected-inner""\,""text__selected-inner_green""]\,""contentLength"":5\,""value"":""Relevant to the meaning""},{""class"":""text__unselected""\,""contentLength"":181}"									https://platform.toloka.ai/task/42737525/00028c1f75--65aeb7ceb7b7c64213124c54	00028c1f75--65aeb242acc1b67a2f3e6693	00028c1f75--65aeb7ceb7b7c64213124c54	10085ad2d0c56f7b4a9348b0ccbafed7	APPROVED	2024-01-22T18:45:34.101
https://i.kym-cdn.com/photos/images/newsfeed/001/475/420/c62.gif	https://knowyourmeme.com/memes/hello-there	Hello There is a memorable quote uttered by the character Obi-Wan Kenobi, portrayed by actor Ewan McGregor, in the 2005 science fiction action film Star Wars: Episode III – Revenge of the Sith. Online, the scene has been used to create various remix videos and image macros, as well as seeing use as a catchphrase.		"{""Relevant to the meaning"":[""Obi-Wan Kenobi\,""]}"		fghfh fghfh fghfh fghfhfh 	yes	"{""class"":""text__unselected""\,""contentLength"":58},{""class"":""text__selected""\,""textInputClasses"":[""text__input""\,""text__input_green""]\,""tagSelectorClasses"":[""text__selected-inner""\,""text__selected-inner_green""]\,""contentLength"":16\,""value"":""Relevant to the meaning""},{""class"":""text__unselected""\,""contentLength"":240}"									https://platform.toloka.ai/task/42737525/00028c1f75--65aeb7f9f0884d28d1452889	00028c1f75--65aeb242acc1b67a2f3e6643	00028c1f75--65aeb7f9f0884d28d1452889	10085ad2d0c56f7b4a9348b0ccbafed7	APPROVED	2024-01-22T18:46:17.585
https://i.kym-cdn.com/photos/images/newsfeed/001/240/075/90f.png	https://knowyourmeme.com/memes/my-job-here-is-done-but-you-didnt-do-anything	My Job Here Is Done is an 3-part exploitable picture from the Japanese animated series Sailor Moon, in which the character Tuxedo Mask dramatically leaves after attributing to himself some credits for a victory. This scene was exploited by many Internet users and edited to parody similar situations in different medias.		"{""Relevant to the meaning"":[""Sailor Moon""]}"		rrrrrrrrrrrrrrrrrrrrrrrrrrrrrrrrrrrrrrrrrrrrrrrrrr	yes	"{""class"":""text__unselected""\,""contentLength"":87},{""class"":""text__selected""\,""textInputClasses"":[""text__input""\,""text__input_green""]\,""tagSelectorClasses"":[""text__selected-inner""\,""text__selected-inner_green""]\,""contentLength"":11\,""value"":""Relevant to the meaning""},{""class"":""text__unselected""\,""contentLength"":222}"									https://platform.toloka.ai/task/42737525/00028c1f75--65aeb8315689527b0264595a	00028c1f75--65aeb243acc1b67a2f3e6701	00028c1f75--65aeb8315689527b0264595a	10085ad2d0c56f7b4a9348b0ccbafed7	APPROVED	2024-01-22T18:47:13.013
https://i.kym-cdn.com/photos/images/newsfeed/001/717/942/188.png	https://knowyourmeme.com/memes/sad-linus	"Sad Linus is a still image of tech YouTuber Linus Sebastian taken from his January 2020 video ""I've been thinking of retiring."" The image, which features Linus staring solemnly at the camera with his headset on, has been used as a reaction image and in ironic memes on Reddit and iFunny."		"{""Relevant to the meaning"":[""Linus Sebastian""]}"		dfgdgdgdgdgdfghfghfhfh	no	"{""class"":""text__unselected""\,""contentLength"":44},{""class"":""text__selected""\,""textInputClasses"":[""text__input""\,""text__input_green""]\,""tagSelectorClasses"":[""text__selected-inner""\,""text__selected-inner_green""]\,""contentLength"":16\,""value"":""Relevant to the meaning""},{""class"":""text__unselected""\,""contentLength"":227}"									https://platform.toloka.ai/task/42737525/00028c1f75--65aeb85eb7b7c64213125741	00028c1f75--65aeb242acc1b67a2f3e66d9	00028c1f75--65aeb85eb7b7c64213125741	10085ad2d0c56f7b4a9348b0ccbafed7	APPROVED	2024-01-22T18:47:58.553
https://i.kym-cdn.com/photos/images/newsfeed/001/562/298/45b.jpg	https://knowyourmeme.com/memes/yes-chad	"Yes Chad, also known as Nordic Gamer, refers to a drawn image of a blond man with blue eyes often wearing a beard, usually captioned ""Yes"" and to the original Wojak Comics format based on the character."		"{""Relevant to the meaning"":[""Chad""\,""Nordic Gamer""]}"		fghfhfhfghhhhhhhhhhhhhh	yes	"{""class"":""text__unselected""\,""contentLength"":4},{""class"":""text__selected""\,""textInputClasses"":[""text__input""\,""text__input_green""]\,""tagSelectorClasses"":[""text__selected-inner""\,""text__selected-inner_green""]\,""contentLength"":4\,""value"":""Relevant to the meaning""},{""class"":""text__unselected""\,""contentLength"":16},{""class"":""text__selected""\,""textInputClasses"":[""text__input""\,""text__input_green""]\,""tagSelectorClasses"":[""text__selected-inner""\,""text__selected-inner_green""]\,""contentLength"":12\,""value"":""Relevant to the meaning""},{""class"":""text__unselected""\,""contentLength"":166}"									https://platform.toloka.ai/task/42737525/00028c1f75--65aeb88bee2612733d3a3d85	00028c1f75--65aeb242acc1b67a2f3e6667	00028c1f75--65aeb88bee2612733d3a3d85	10085ad2d0c56f7b4a9348b0ccbafed7	APPROVED	2024-01-22T18:48:43.051
https://i.kym-cdn.com/photos/images/newsfeed/000/591/926/700.jpg	https://knowyourmeme.com/memes/feels-good	Feels Good, not to be confused with Feels Good, Man, is an exploitable image of a man looking very satisfied while touching his face with both hands. On 4chan, the image is used to express satisfaction in response to another post.		"{""Relevant to the meaning"":[""exploitable image""]}"		fghhhhhhhhhhhhhdfgdg ghjg	yes	"{""class"":""text__unselected""\,""contentLength"":59},{""class"":""text__selected""\,""textInputClasses"":[""text__input""\,""text__input_green""]\,""tagSelectorClasses"":[""text__selected-inner""\,""text__selected-inner_green""]\,""contentLength"":18\,""value"":""Relevant to the meaning""},{""class"":""text__unselected""\,""contentLength"":153}"									https://platform.toloka.ai/task/42737525/00028c1f75--65aeb8adb7b7c64213125e71	00028c1f75--65aeb242acc1b67a2f3e6675	00028c1f75--65aeb8adb7b7c64213125e71	10085ad2d0c56f7b4a9348b0ccbafed7	APPROVED	2024-01-22T18:49:17.349
https://i.kym-cdn.com/photos/images/newsfeed/001/340/526/3bb.jpg	https://knowyourmeme.com/memes/monkey-puppet	Monkey Puppet refers to a reaction image and GIF of a puppet appearing surprised. It’s used to express shock, particularly in situations where one party owns another in a verbal exchange.		"{""Relevant to the meaning"":[""Monkey Puppet""]}"		dfgdgdgd gdfgdbhfvgdg df	no	"{""class"":""text__selected""\,""textInputClasses"":[""text__input""\,""text__input_green""]\,""tagSelectorClasses"":[""text__selected-inner""\,""text__selected-inner_green""]\,""contentLength"":14\,""value"":""Relevant to the meaning""},{""class"":""text__unselected""\,""contentLength"":173}"									https://platform.toloka.ai/task/42737525/00028c1f75--65aeb8dbb7b7c6421312621c	00028c1f75--65aeb242acc1b67a2f3e66a1	00028c1f75--65aeb8dbb7b7c6421312621c	10085ad2d0c56f7b4a9348b0ccbafed7	APPROVED	2024-01-22T18:50:03.546
https://i.kym-cdn.com/photos/images/newsfeed/001/256/693/d63.jpeg	https://knowyourmeme.com/memes/la-noire-doubt-press-x-to-doubt	"L.A. Noire ""Doubt"", also known as Press X to Doubt, is a reaction image taken from the video game L.A. Noire by Rockstar Games used in memes to express disbelief in a headline or a thread's previous statement."		"{""Relevant to the meaning"":[""Press X""]}"		dfgdfgdgdgdgdgdgdghgfjgj	yes	"{""class"":""text__unselected""\,""contentLength"":34},{""class"":""text__selected""\,""textInputClasses"":[""text__input""\,""text__input_green""]\,""tagSelectorClasses"":[""text__selected-inner""\,""text__selected-inner_green""]\,""contentLength"":8\,""value"":""Relevant to the meaning""},{""class"":""text__unselected""\,""contentLength"":167}"									https://platform.toloka.ai/task/42737525/00028c1f75--65aeb8fc5689527b02646878	00028c1f75--65aeb242acc1b67a2f3e667f	00028c1f75--65aeb8fc5689527b02646878	10085ad2d0c56f7b4a9348b0ccbafed7	APPROVED	2024-01-22T18:50:36.283
https://i.kym-cdn.com/photos/images/newsfeed/000/531/557/a88.jpg	https://knowyourmeme.com/memes/we-need-to-go-deeper	“We Need To Go Deeper” is an expression from the film Inception which is often featured in image macros and vertical multi-panes using screen captures from the movie. The phrase can indicate that further investigation is needed but can also be used to point out examples of recursion, in a similar vein to the Xzibit Yo Dawg image macro series.		"{""Relevant to the meaning"":[""“We Need To Go Deeper”""]}"		dfgdgdfgggggggggggggggggggggggggggggg	no	"{""class"":""text__selected""\,""textInputClasses"":[""text__input""\,""text__input_green""]\,""tagSelectorClasses"":[""text__selected-inner""\,""text__selected-inner_green""]\,""contentLength"":23\,""value"":""Relevant to the meaning""},{""class"":""text__unselected""\,""contentLength"":321}"									https://platform.toloka.ai/task/42737525/00028c1f75--65aeb925ee2612733d3a48a4	00028c1f75--65aeb243acc1b67a2f3e6707	00028c1f75--65aeb925ee2612733d3a48a4	10085ad2d0c56f7b4a9348b0ccbafed7	APPROVED	2024-01-22T18:51:17.034
https://i.kym-cdn.com/photos/images/newsfeed/001/879/958/fb1.gif	https://knowyourmeme.com/memes/catjam-vibing-cat	CatJAM is a BetterTTV custom Twitch emote of a white cat rhythmically bobbing its head as if to the beat of a song. Originating from a viral video, the emote gained major success on Twitch after being enabled by multiple popular streamers, later gaining popularity as source material for memes. The GIF and the video are also known as Vibing Cat and Grooving Cat.		"{""Relevant to the meaning"":[""success on Twitch after""]}"		ghfffffffffffffffffffffffghfghfh	yes	"{""class"":""text__unselected""\,""contentLength"":171},{""class"":""text__selected""\,""textInputClasses"":[""text__input""\,""text__input_green""]\,""tagSelectorClasses"":[""text__selected-inner""\,""text__selected-inner_green""]\,""contentLength"":24\,""value"":""Relevant to the meaning""},{""class"":""text__unselected""\,""contentLength"":168}"									https://platform.toloka.ai/task/42737525/00028c1f75--65aeb945acc1b67a2f3f9f1d	00028c1f75--65aeb242acc1b67a2f3e6689	00028c1f75--65aeb945acc1b67a2f3f9f1d	10085ad2d0c56f7b4a9348b0ccbafed7	APPROVED	2024-01-22T18:51:49.928
https://i.kym-cdn.com/photos/images/newsfeed/001/783/837/056.png	https://knowyourmeme.com/memes/%F0%9F%91%89%F0%9F%91%88-two-fingers-touching	👉👈 Two Fingers Touching are two index finger emojis pointing towards one another which typically signify shyness or hesitation when asking a question. Although the set of emojis have been used since they were available for iPhone in 2011, the action of performing the finger touch or adding it to text in memes became popular in March 2020 on Twitter and TikTok. The emoji combination has often been used together with the Pleading Emoji.		"{""Relevant to the meaning"":[""Two Fingers Touching""]}"		fghgfhfbfgbvgbvnfnfnfn	yes	"{""class"":""text__unselected""\,""contentLength"":5},{""class"":""text__selected""\,""textInputClasses"":[""text__input""\,""text__input_green""]\,""tagSelectorClasses"":[""text__selected-inner""\,""text__selected-inner_green""]\,""contentLength"":21\,""value"":""Relevant to the meaning""},{""class"":""text__unselected""\,""contentLength"":414}"									https://platform.toloka.ai/task/42737525/00028c1f75--65aeb967acc1b67a2f3fa179	00028c1f75--65aeb243acc1b67a2f3e6703	00028c1f75--65aeb967acc1b67a2f3fa179	10085ad2d0c56f7b4a9348b0ccbafed7	APPROVED	2024-01-22T18:52:23.029
https://i.kym-cdn.com/photos/images/newsfeed/000/239/099/cc9.jpg	https://knowyourmeme.com/memes/first-day-on-the-internet-kid	First Day on the Internet Kid is a new and inexperienced Internet user who is unfamiliar with certain aspects of the web and is often described as a younger version of Lonely Computer Guy / Net Noob.		"{""Relevant to the meaning"":[""Internet Kid""]}"		fhfdhfhgfgdjfjfjjfjfjfj	yes	"{""class"":""text__unselected""\,""contentLength"":17},{""class"":""text__selected""\,""textInputClasses"":[""text__input""\,""text__input_green""]\,""tagSelectorClasses"":[""text__selected-inner""\,""text__selected-inner_green""]\,""contentLength"":13\,""value"":""Relevant to the meaning""},{""class"":""text__unselected""\,""contentLength"":169}"									https://platform.toloka.ai/task/42737525/00028c1f75--65aeb989f0884d28d145481b	00028c1f75--65aeb242acc1b67a2f3e668f	00028c1f75--65aeb989f0884d28d145481b	10085ad2d0c56f7b4a9348b0ccbafed7	APPROVED	2024-01-22T18:52:57.259
https://i.kym-cdn.com/photos/images/newsfeed/000/793/340/387.png	https://knowyourmeme.com/memes/jared-leto-hugging-things	Jared Leto Hugging Things is a photoshop meme in which people take a photo the actor posted to his Instagram account featuring him hugging a tree and photoshop it so it appears Leto is hugging other things.		"{""Relevant to the meaning"":[""Jared Leto Hugging Things""]}"		srfgdfgdfgdgdgdgdgdgdf	no	"{""class"":""text__selected""\,""textInputClasses"":[""text__input""\,""text__input_green""]\,""tagSelectorClasses"":[""text__selected-inner""\,""text__selected-inner_green""]\,""contentLength"":26\,""value"":""Relevant to the meaning""},{""class"":""text__unselected""\,""contentLength"":180}"									https://platform.toloka.ai/task/42737525/00028c1f75--65aeb99facc1b67a2f3fa602	00028c1f75--65aeb241acc1b67a2f3e6629	00028c1f75--65aeb99facc1b67a2f3fa602	10085ad2d0c56f7b4a9348b0ccbafed7	APPROVED	2024-01-22T18:53:19.912
https://i.kym-cdn.com/photos/images/newsfeed/000/759/360/bc3.png	https://knowyourmeme.com/memes/dad-joke-dog	Dad Joke Dog is an advice animal image macro series featuring a three image set of a dog and a baby. The first image features the set up of the joke with the dog turned to the baby, the second image features the punchline with the dog turned slightly away, while the third is a reaction shot with both the baby and the dog turned to the camera. The jokes are corny, stereotypical dad jokes similar to those featured on Pun Dog.		"{""Relevant to the meaning"":[""Dad Joke Dog""\,""dog turned to the baby\, the second image features the punchline with the dog turned slightly away\, while the third is a reaction shot with""]}"		eaning if you highlighted 'Relevant	no	"{""class"":""text__selected""\,""textInputClasses"":[""text__input""\,""text__input_green""]\,""tagSelectorClasses"":[""text__selected-inner""\,""text__selected-inner_green""]\,""contentLength"":13\,""value"":""Relevant to the meaning""},{""class"":""text__unselected""\,""contentLength"":145},{""class"":""text__selected""\,""textInputClasses"":[""text__input""\,""text__input_green""]\,""tagSelectorClasses"":[""text__selected-inner""\,""text__selected-inner_green""]\,""contentLength"":139\,""value"":""Relevant to the meaning""},{""class"":""text__unselected""\,""contentLength"":130}"									https://platform.toloka.ai/task/42737525/00028c1f75--65aeb9d3753d7e7cfcff81da	00028c1f75--65aeb242acc1b67a2f3e662f	00028c1f75--65aeb9d3753d7e7cfcff81da	10085ad2d0c56f7b4a9348b0ccbafed7	APPROVED	2024-01-22T18:54:11.005
https://i.kym-cdn.com/photos/images/newsfeed/000/788/622/5e6.gif	https://knowyourmeme.com/memes/denied-encino-man	Denied Encino Man is a reaction GIF of American actor Michael DeLuise shaking his head in disapproval in a scene from the 1992 comedy film Encino Man. On image boards and discussion forums, the reaction GIF is often used to convey disapproval or rejection of an idea once thought to be promising.		"{""Relevant to the meaning"":[""Michael DeLuise""]}"		jkgkgkgkgjjjjjjjjjjjjjjjjjjjjjjjjh	yes	"{""class"":""text__unselected""\,""contentLength"":54},{""class"":""text__selected""\,""textInputClasses"":[""text__input""\,""text__input_green""]\,""tagSelectorClasses"":[""text__selected-inner""\,""text__selected-inner_green""]\,""contentLength"":16\,""value"":""Relevant to the meaning""},{""class"":""text__unselected""\,""contentLength"":226}"									https://platform.toloka.ai/task/42737525/00028c1f75--65aeb9fdf0884d28d1455257	00028c1f75--65aeb241acc1b67a2f3e662d	00028c1f75--65aeb9fdf0884d28d1455257	10085ad2d0c56f7b4a9348b0ccbafed7	APPROVED	2024-01-22T18:54:53.662
https://i.kym-cdn.com/photos/images/newsfeed/000/962/640/658.png	https://knowyourmeme.com/memes/this-is-fine	This Is Fine. refers to a panel from the web comic  Gunshow where a dog is slowly engulfed in flames while proclaiming that everything is fine. It is used as a reaction image used by forum posters trying to say calm in stressful situations.		"{""Relevant to the meaning"":[""Gunshow where a""]}"		eme's meaning if you highlighted 'Relevant to the mean	yes	"{""class"":""text__unselected""\,""contentLength"":51},{""class"":""text__selected""\,""textInputClasses"":[""text__input""\,""text__input_green""]\,""tagSelectorClasses"":[""text__selected-inner""\,""text__selected-inner_green""]\,""contentLength"":17\,""value"":""Relevant to the meaning""},{""class"":""text__unselected""\,""contentLength"":172}"									https://platform.toloka.ai/task/42737525/00028c1f75--65aeba22ee2612733d3a5edf	00028c1f75--65aeb242acc1b67a2f3e6649	00028c1f75--65aeba22ee2612733d3a5edf	10085ad2d0c56f7b4a9348b0ccbafed7	APPROVED	2024-01-22T18:55:30.766
https://i.kym-cdn.com/photos/images/newsfeed/001/191/035/135.png	https://knowyourmeme.com/memes/ackchyually-actually-guy	Ackchyually refers to an illustration of a neckbeard in which the word “actually” is intentionally misspelled so the reader reads it in the phlegmy cadence associated with nerd culture stereotypes. It is usually used as a reaction image to humorously express doubt at hopeful captions.		"{""Relevant to the meaning"":[""Ackchyually""]}"		g if you highlighted 'Relevant to the meaning	yes	"{""class"":""text__selected""\,""textInputClasses"":[""text__input""\,""text__input_green""]\,""tagSelectorClasses"":[""text__selected-inner""\,""text__selected-inner_green""]\,""contentLength"":12\,""value"":""Relevant to the meaning""},{""class"":""text__unselected""\,""contentLength"":273}"									https://platform.toloka.ai/task/42737525/00028c1f75--65aeba47753d7e7cfcff8b9d	00028c1f75--65aeb242acc1b67a2f3e66ab	00028c1f75--65aeba47753d7e7cfcff8b9d	10085ad2d0c56f7b4a9348b0ccbafed7	APPROVED	2024-01-22T18:56:07.356
https://i.kym-cdn.com/photos/images/newsfeed/000/439/824/c4a.png	https://knowyourmeme.com/memes/ive-made-a-huge-mistake	“I’ve Made a Huge Mistake” is an expression indicating that the speaker feels remorse for something that he or she has done. It is often associated with a reaction GIF featuring the character Gob from the television sitcom Arrested Development.		"{""Relevant to the meaning"":[""“I’ve Made a Huge Mistake”""]}"		ing if you highlighted 'Relevant to the meaning'	yes	"{""class"":""text__selected""\,""textInputClasses"":[""text__input""\,""text__input_green""]\,""tagSelectorClasses"":[""text__selected-inner""\,""text__selected-inner_green""]\,""contentLength"":27\,""value"":""Relevant to the meaning""},{""class"":""text__unselected""\,""contentLength"":217}"									https://platform.toloka.ai/task/42737525/00028c1f75--65aeba9ff0884d28d1456275	00028c1f75--65aeb242acc1b67a2f3e663b	00028c1f75--65aeba9ff0884d28d1456275	10085ad2d0c56f7b4a9348b0ccbafed7	APPROVED	2024-01-22T18:57:35.392
https://i.kym-cdn.com/photos/images/newsfeed/000/396/532/019.gif	https://knowyourmeme.com/memes/are-you-a-wizard	Are You a Wizard? is an image macro series typically featuring wall-eyed subjects staring into the distance while wearing a confused-looking expression. It is sometimes used as a reaction image to an extraordinary or absurd remark on imageboards or web forums and can be used sarcastically to point out an obvious statement in a similar vein to Captain Obvious.		"{""Relevant to the meaning"":[""wall-eyed subjects staring into the distance""]}"		'Relevant to the meaning'	no	"{""class"":""text__unselected""\,""contentLength"":63},{""class"":""text__selected""\,""textInputClasses"":[""text__input""\,""text__input_green""]\,""tagSelectorClasses"":[""text__selected-inner""\,""text__selected-inner_green""]\,""contentLength"":45\,""value"":""Relevant to the meaning""},{""class"":""text__unselected""\,""contentLength"":253}"									https://platform.toloka.ai/task/42737525/00028c1f75--65aebac1753d7e7cfcff9812	00028c1f75--65aeb242acc1b67a2f3e6659	00028c1f75--65aebac1753d7e7cfcff9812	10085ad2d0c56f7b4a9348b0ccbafed7	APPROVED	2024-01-22T18:58:09.893
https://i.kym-cdn.com/photos/images/newsfeed/000/416/789/c98.jpg	https://knowyourmeme.com/memes/fuck-me-right	Fuck Me, Right? is an image macro series featuring a screen capture of Jonah Hill sarcastically laughing in the 2007 comedy film Superbad. The top caption usually contains a confession about an unpopular opinion or noobish behavior, accompanied by the bottom caption “Fuck me, right?” The expression is meant to convey self-pity and resignation to the way the speaker is perceived by the majority.		"{""Relevant to the meaning"":[""capture of Jonah Hill sarcastically laughing""]}"		eaning if you highlighted 'Relevant to the meaning	yes	"{""class"":""text__unselected""\,""contentLength"":60},{""class"":""text__selected""\,""textInputClasses"":[""text__input""\,""text__input_green""]\,""tagSelectorClasses"":[""text__selected-inner""\,""text__selected-inner_green""]\,""contentLength"":45\,""value"":""Relevant to the meaning""},{""class"":""text__unselected""\,""contentLength"":292}"									https://platform.toloka.ai/task/42737525/00028c1f75--65aebae0753d7e7cfcff9b6d	00028c1f75--65aeb242acc1b67a2f3e663d	00028c1f75--65aebae0753d7e7cfcff9b6d	10085ad2d0c56f7b4a9348b0ccbafed7	APPROVED	2024-01-22T18:58:40.764
https://i.kym-cdn.com/photos/images/newsfeed/001/168/745/e42.jpg	https://knowyourmeme.com/memes/darth-vaders-noooo	"Darth Vader's ""Noooo!"" refers to the widely parodied scene from the 2005 film Star Wars Episode III Revenge of the Sith, the third and final installment of the Star Wars prequel trilogy in which Darth Vader yells ""No!"" after finding out the fate of his pregnant wife, Padmé Amidala. This yell was also added in the 2011 Blu-Ray version of the movie Return of the Jedi. In memes, the clip has been used as an exploitable in YouTube Poops, as a reaction image and GIF, as well as various image macros over the years."		"{""Relevant to the meaning"":[""Star Wars Episode III Revenge""]}"		Write your understanding of the meme's meaning if you highlighted 'Relevant to the meaning' 	no	"{""class"":""text__unselected""\,""contentLength"":78},{""class"":""text__selected""\,""textInputClasses"":[""text__input""\,""text__input_green""]\,""tagSelectorClasses"":[""text__selected-inner""\,""text__selected-inner_green""]\,""contentLength"":30\,""value"":""Relevant to the meaning""},{""class"":""text__unselected""\,""contentLength"":406}"									https://platform.toloka.ai/task/42737525/00028c1f75--65aebb04b7b7c6421312901d	00028c1f75--65aeb242acc1b67a2f3e669b	00028c1f75--65aebb04b7b7c6421312901d	10085ad2d0c56f7b4a9348b0ccbafed7	APPROVED	2024-01-22T18:59:16.127
https://i.kym-cdn.com/photos/images/newsfeed/001/407/224/0bc.png	https://knowyourmeme.com/memes/excuse-me-what-the-fuck	"Excuse Me What The Fuck is a series of reaction image macros of a distorted image of the character Vault Boy from the video game Fallout. The image features the caption ""excuse me what the fuck"" to express disbelief."		"{""Relevant to the meaning"":[""Excuse Me What The Fuck""]}"		Relevant to the meaning'	yes	"{""class"":""text__selected""\,""textInputClasses"":[""text__input""\,""text__input_green""]\,""tagSelectorClasses"":[""text__selected-inner""\,""text__selected-inner_green""]\,""contentLength"":24\,""value"":""Relevant to the meaning""},{""class"":""text__unselected""\,""contentLength"":192}"									https://platform.toloka.ai/task/42737525/00028c1f75--65aebb27ee2612733d3a7895	00028c1f75--65aeb242acc1b67a2f3e6691	00028c1f75--65aebb27ee2612733d3a7895	10085ad2d0c56f7b4a9348b0ccbafed7	APPROVED	2024-01-22T18:59:51.107
https://i.kym-cdn.com/photos/images/newsfeed/001/070/332/b7a.jpg	https://knowyourmeme.com/memes/what-did-he-mean-by-this	What Did He Mean By This? is a question often posted on 4chan as a form of shitposting for lines that are either simplistic in nature, or confusing to the audience, it often seeks equally satirical responses. although its posted on most 4chan boards its seen used often on /tv/, /mu/ and [s4s].		"{""Relevant to the meaning"":[""He""]}"		evant to the meanng if you highlighte	no	"{""class"":""text__unselected""\,""contentLength"":9},{""class"":""text__selected""\,""textInputClasses"":[""text__input""\,""text__input_green""]\,""tagSelectorClasses"":[""text__selected-inner""\,""text__selected-inner_green""]\,""contentLength"":3\,""value"":""Relevant to the meaning""},{""class"":""text__unselected""\,""contentLength"":282}"									https://platform.toloka.ai/task/42737525/00028c1f75--65aebb49ee2612733d3a7bb3	00028c1f75--65aeb241acc1b67a2f3e6620	00028c1f75--65aebb49ee2612733d3a7bb3	10085ad2d0c56f7b4a9348b0ccbafed7	APPROVED	2024-01-22T19:00:25.539
